=== Job started: Thu May 28 16:56:36 CEST 2026 ===
Node:       rtx6000gpu1
Image type: ms
=== Python: Python 3.12.13 | venv active ===
=== Starting hyperparameter tuning (ms) ===

=== Tuning ms ===
Removed 0 bombay files and 0 jakarta files from SeaLake
[I 2026-05-28 16:59:16,043] A new study created in memory with name: ms
Epoch 1, Val loss: 0.3401, Val F1: 0.8827
Epoch 2, Val loss: 0.2409, Val F1: 0.9197
Epoch 3, Val loss: 0.2212, Val F1: 0.9207
Epoch 4, Val loss: 0.2073, Val F1: 0.9317
Epoch 5, Val loss: 0.2216, Val F1: 0.9273
Epoch 6, Val loss: 0.1463, Val F1: 0.9544
Epoch 7, Val loss: 0.1475, Val F1: 0.9518
Epoch 8, Val loss: 0.1667, Val F1: 0.9455
Epoch 9, Val loss: 0.1037, Val F1: 0.9700
Epoch 10, Val loss: 0.1275, Val F1: 0.9583
Epoch 11, Val loss: 0.1078, Val F1: 0.9654
Epoch 12, Val loss: 0.1076, Val F1: 0.9648
Epoch 13, Val loss: 0.1294, Val F1: 0.9573
Epoch 14, Val loss: 0.1451, Val F1: 0.9581
[I 2026-05-28 17:00:47,558] Trial 0 finished with value: 0.970024514806067 and parameters: {'n_conv_blocks': 4, 'base_channels': 64, 'kernels': 'single_5', 'n_fc_layers': 2, 'fc_hidden': 512, 'dropout': 0.5905425492993032, 'activation': 'gelu', 'lr': 0.00020179165698529353}. Best is trial 0 with value: 0.970024514806067.
Epoch 1, Val loss: 0.3969, Val F1: 0.8609
Epoch 2, Val loss: 0.3101, Val F1: 0.8976
Epoch 3, Val loss: 0.2234, Val F1: 0.9264
Epoch 4, Val loss: 0.2310, Val F1: 0.9199
Epoch 5, Val loss: 0.1838, Val F1: 0.9374
Epoch 6, Val loss: 0.2382, Val F1: 0.9227
Epoch 7, Val loss: 0.1877, Val F1: 0.9355
Epoch 8, Val loss: 0.1559, Val F1: 0.9438
Epoch 9, Val loss: 0.1625, Val F1: 0.9497
Epoch 10, Val loss: 0.1490, Val F1: 0.9498
Epoch 11, Val loss: 0.1486, Val F1: 0.9537
Epoch 12, Val loss: 0.1862, Val F1: 0.9372
Epoch 13, Val loss: 0.1503, Val F1: 0.9514
Epoch 14, Val loss: 0.1504, Val F1: 0.9467
Epoch 15, Val loss: 0.1387, Val F1: 0.9566
Epoch 16, Val loss: 0.1590, Val F1: 0.9501
Epoch 17, Val loss: 0.1239, Val F1: 0.9615
Epoch 18, Val loss: 0.1476, Val F1: 0.9522
Epoch 19, Val loss: 0.1307, Val F1: 0.9581
Epoch 20, Val loss: 0.1629, Val F1: 0.9502
Epoch 21, Val loss: 0.1459, Val F1: 0.9517
Epoch 22, Val loss: 0.1373, Val F1: 0.9570
[I 2026-05-28 17:02:02,107] Trial 1 finished with value: 0.9614914893356097 and parameters: {'n_conv_blocks': 3, 'base_channels': 16, 'kernels': 'multi_3_5_7_9', 'n_fc_layers': 2, 'fc_hidden': 128, 'dropout': 0.37803600299299167, 'activation': 'gelu', 'lr': 0.0007076993531136383}. Best is trial 0 with value: 0.970024514806067.
Epoch 1, Val loss: 1.0767, Val F1: 0.5520
Epoch 2, Val loss: 0.8514, Val F1: 0.7362
Epoch 3, Val loss: 0.6969, Val F1: 0.7486
Epoch 4, Val loss: 0.5509, Val F1: 0.8272
Epoch 5, Val loss: 0.4489, Val F1: 0.8572
Epoch 6, Val loss: 0.4121, Val F1: 0.8702
Epoch 7, Val loss: 0.4303, Val F1: 0.8624
Epoch 8, Val loss: 0.4114, Val F1: 0.8766
Epoch 9, Val loss: 0.5025, Val F1: 0.8540
Epoch 10, Val loss: 0.5451, Val F1: 0.7438
Epoch 11, Val loss: 0.5334, Val F1: 0.7945
Epoch 12, Val loss: 0.3897, Val F1: 0.8802
Epoch 13, Val loss: 0.3299, Val F1: 0.9138
Epoch 14, Val loss: 0.3366, Val F1: 0.9132
Epoch 15, Val loss: 0.3905, Val F1: 0.8913
Epoch 16, Val loss: 1.2845, Val F1: 0.7622
Epoch 17, Val loss: 0.4753, Val F1: 0.8854
Epoch 18, Val loss: 0.3425, Val F1: 0.9009
[I 2026-05-28 17:02:54,620] Trial 2 finished with value: 0.9138082676159606 and parameters: {'n_conv_blocks': 4, 'base_channels': 16, 'kernels': 'multi_3_5', 'n_fc_layers': 2, 'fc_hidden': 512, 'dropout': 0.39468848290452735, 'activation': 'gelu', 'lr': 0.009674433526175127}. Best is trial 0 with value: 0.970024514806067.
Epoch 1, Val loss: 1.6891, Val F1: 0.3009
Epoch 2, Val loss: 2.2496, Val F1: 0.0528
Epoch 3, Val loss: 2.3400, Val F1: 0.0200
Epoch 4, Val loss: 2.3426, Val F1: 0.0200
Epoch 5, Val loss: 2.3395, Val F1: 0.0200
Epoch 6, Val loss: 2.3484, Val F1: 0.0200
[I 2026-05-28 17:03:11,832] Trial 3 finished with value: 0.3008789885206842 and parameters: {'n_conv_blocks': 2, 'base_channels': 64, 'kernels': 'multi_3_7', 'n_fc_layers': 2, 'fc_hidden': 256, 'dropout': 0.5984232481036591, 'activation': 'gelu', 'lr': 0.007420047985032866}. Best is trial 0 with value: 0.970024514806067.
Epoch 1, Val loss: 0.4877, Val F1: 0.8360
Epoch 2, Val loss: 0.3904, Val F1: 0.8688
Epoch 3, Val loss: 0.3063, Val F1: 0.8941
Epoch 4, Val loss: 0.2584, Val F1: 0.9178
Epoch 5, Val loss: 0.2867, Val F1: 0.9027
Epoch 6, Val loss: 0.2366, Val F1: 0.9229
Epoch 7, Val loss: 0.1602, Val F1: 0.9446
Epoch 8, Val loss: 0.1878, Val F1: 0.9362
Epoch 9, Val loss: 0.1967, Val F1: 0.9352
Epoch 10, Val loss: 0.1455, Val F1: 0.9513
Epoch 11, Val loss: 0.1745, Val F1: 0.9462
Epoch 12, Val loss: 0.1440, Val F1: 0.9502
Epoch 13, Val loss: 0.1573, Val F1: 0.9468
Epoch 14, Val loss: 0.1284, Val F1: 0.9575
Epoch 15, Val loss: 0.1356, Val F1: 0.9541
Epoch 16, Val loss: 0.1434, Val F1: 0.9566
Epoch 17, Val loss: 0.1113, Val F1: 0.9627
Epoch 18, Val loss: 0.1408, Val F1: 0.9520
Epoch 19, Val loss: 0.1280, Val F1: 0.9600
Epoch 20, Val loss: 0.1148, Val F1: 0.9635
Epoch 21, Val loss: 0.1205, Val F1: 0.9641
Epoch 22, Val loss: 0.1335, Val F1: 0.9558
Epoch 23, Val loss: 0.1115, Val F1: 0.9672
Epoch 24, Val loss: 0.1578, Val F1: 0.9566
Epoch 25, Val loss: 0.1775, Val F1: 0.9561
Epoch 26, Val loss: 0.1188, Val F1: 0.9633
Epoch 27, Val loss: 0.1160, Val F1: 0.9648
Epoch 28, Val loss: 0.1084, Val F1: 0.9693
Epoch 29, Val loss: 0.1293, Val F1: 0.9628
Epoch 30, Val loss: 0.0973, Val F1: 0.9694
[I 2026-05-28 17:04:39,915] Trial 4 finished with value: 0.9693550123616894 and parameters: {'n_conv_blocks': 4, 'base_channels': 16, 'kernels': 'single_5', 'n_fc_layers': 2, 'fc_hidden': 64, 'dropout': 0.2622525978256445, 'activation': 'relu', 'lr': 0.0009734724733755704}. Best is trial 0 with value: 0.970024514806067.
Epoch 1, Val loss: 0.6932, Val F1: 0.7516
[I 2026-05-28 17:04:42,827] Trial 5 pruned. 
Epoch 1, Val loss: 0.3628, Val F1: 0.8713
Epoch 2, Val loss: 0.2957, Val F1: 0.8981
Epoch 3, Val loss: 0.2370, Val F1: 0.9206
Epoch 4, Val loss: 0.2140, Val F1: 0.9278
Epoch 5, Val loss: 0.2168, Val F1: 0.9241
Epoch 6, Val loss: 0.2000, Val F1: 0.9370
Epoch 7, Val loss: 0.1838, Val F1: 0.9402
Epoch 8, Val loss: 0.2276, Val F1: 0.9271
Epoch 9, Val loss: 0.2124, Val F1: 0.9319
[I 2026-05-28 17:05:08,170] Trial 6 pruned. 
Epoch 1, Val loss: 0.5374, Val F1: 0.8006
[I 2026-05-28 17:05:11,095] Trial 7 pruned. 
Epoch 1, Val loss: 0.4056, Val F1: 0.8663
Epoch 2, Val loss: 0.2675, Val F1: 0.9039
Epoch 3, Val loss: 0.2644, Val F1: 0.9059
Epoch 4, Val loss: 0.2281, Val F1: 0.9228
Epoch 5, Val loss: 0.2323, Val F1: 0.9232
Epoch 6, Val loss: 0.1902, Val F1: 0.9371
Epoch 7, Val loss: 0.1751, Val F1: 0.9435
Epoch 8, Val loss: 0.1887, Val F1: 0.9374
Epoch 9, Val loss: 0.2119, Val F1: 0.9354
Epoch 10, Val loss: 0.1899, Val F1: 0.9396
[I 2026-05-28 17:05:40,441] Trial 8 pruned. 
Epoch 1, Val loss: 0.7763, Val F1: 0.7512
[I 2026-05-28 17:05:43,720] Trial 9 pruned. 
Epoch 1, Val loss: 0.4162, Val F1: 0.8728
Epoch 2, Val loss: 0.3274, Val F1: 0.8914
Epoch 3, Val loss: 0.2096, Val F1: 0.9380
Epoch 4, Val loss: 0.2223, Val F1: 0.9250
Epoch 5, Val loss: 0.1570, Val F1: 0.9462
Epoch 6, Val loss: 0.1814, Val F1: 0.9387
Epoch 7, Val loss: 0.1861, Val F1: 0.9360
Epoch 8, Val loss: 0.1107, Val F1: 0.9637
Epoch 9, Val loss: 0.1576, Val F1: 0.9533
Epoch 10, Val loss: 0.1418, Val F1: 0.9545
Epoch 11, Val loss: 0.1756, Val F1: 0.9471
Epoch 12, Val loss: 0.1356, Val F1: 0.9550
Epoch 13, Val loss: 0.1125, Val F1: 0.9654
Epoch 14, Val loss: 0.1490, Val F1: 0.9505
Epoch 15, Val loss: 0.1338, Val F1: 0.9595
Epoch 16, Val loss: 0.0828, Val F1: 0.9746
Epoch 17, Val loss: 0.0826, Val F1: 0.9744
Epoch 18, Val loss: 0.1240, Val F1: 0.9606
Epoch 19, Val loss: 0.1324, Val F1: 0.9617
Epoch 20, Val loss: 0.0991, Val F1: 0.9741
Epoch 21, Val loss: 0.0989, Val F1: 0.9711
[I 2026-05-28 17:08:13,155] Trial 10 finished with value: 0.974552540913859 and parameters: {'n_conv_blocks': 4, 'base_channels': 128, 'kernels': 'multi_3_5_7_9', 'n_fc_layers': 3, 'fc_hidden': 512, 'dropout': 0.48261637753015446, 'activation': 'silu', 'lr': 0.00012182852688883122}. Best is trial 10 with value: 0.974552540913859.
Epoch 1, Val loss: 0.3412, Val F1: 0.8950
Epoch 2, Val loss: 0.2391, Val F1: 0.9177
Epoch 3, Val loss: 0.1872, Val F1: 0.9381
Epoch 4, Val loss: 0.2468, Val F1: 0.9242
Epoch 5, Val loss: 0.1995, Val F1: 0.9312
Epoch 6, Val loss: 0.1568, Val F1: 0.9487
Epoch 7, Val loss: 0.1831, Val F1: 0.9448
Epoch 8, Val loss: 0.1355, Val F1: 0.9554
Epoch 9, Val loss: 0.1242, Val F1: 0.9614
Epoch 10, Val loss: 0.1086, Val F1: 0.9680
Epoch 11, Val loss: 0.1316, Val F1: 0.9567
Epoch 12, Val loss: 0.1222, Val F1: 0.9598
Epoch 13, Val loss: 0.1144, Val F1: 0.9642
Epoch 14, Val loss: 0.1350, Val F1: 0.9580
Epoch 15, Val loss: 0.1403, Val F1: 0.9570
[I 2026-05-28 17:10:00,215] Trial 11 finished with value: 0.9680174422663701 and parameters: {'n_conv_blocks': 4, 'base_channels': 128, 'kernels': 'multi_3_5_7_9', 'n_fc_layers': 3, 'fc_hidden': 512, 'dropout': 0.4858192896927864, 'activation': 'silu', 'lr': 0.00010416359335022514}. Best is trial 10 with value: 0.974552540913859.
Epoch 1, Val loss: 0.3633, Val F1: 0.8793
Epoch 2, Val loss: 0.2950, Val F1: 0.9121
Epoch 3, Val loss: 0.1844, Val F1: 0.9396
Epoch 4, Val loss: 0.1570, Val F1: 0.9450
Epoch 5, Val loss: 0.2033, Val F1: 0.9353
Epoch 6, Val loss: 0.1690, Val F1: 0.9487
Epoch 7, Val loss: 0.1299, Val F1: 0.9568
Epoch 8, Val loss: 0.1303, Val F1: 0.9565
Epoch 9, Val loss: 0.1230, Val F1: 0.9593
Epoch 10, Val loss: 0.1044, Val F1: 0.9692
Epoch 11, Val loss: 0.1338, Val F1: 0.9563
Epoch 12, Val loss: 0.1120, Val F1: 0.9642
Epoch 13, Val loss: 0.0939, Val F1: 0.9703
Epoch 14, Val loss: 0.1092, Val F1: 0.9670
Epoch 15, Val loss: 0.1643, Val F1: 0.9496
Epoch 16, Val loss: 0.0892, Val F1: 0.9731
Epoch 17, Val loss: 0.1181, Val F1: 0.9653
Epoch 18, Val loss: 0.1002, Val F1: 0.9677
Epoch 19, Val loss: 0.1338, Val F1: 0.9621
Epoch 20, Val loss: 0.0922, Val F1: 0.9740
Epoch 21, Val loss: 0.0903, Val F1: 0.9753
Epoch 22, Val loss: 0.1021, Val F1: 0.9684
Epoch 23, Val loss: 0.1016, Val F1: 0.9720
Epoch 24, Val loss: 0.0975, Val F1: 0.9691
Epoch 25, Val loss: 0.0912, Val F1: 0.9749
Epoch 26, Val loss: 0.1046, Val F1: 0.9721
[I 2026-05-28 17:13:04,336] Trial 12 finished with value: 0.975298783288449 and parameters: {'n_conv_blocks': 4, 'base_channels': 128, 'kernels': 'multi_3_5_7_9', 'n_fc_layers': 3, 'fc_hidden': 512, 'dropout': 0.4790204983961076, 'activation': 'silu', 'lr': 0.00013559608187284903}. Best is trial 12 with value: 0.975298783288449.
Epoch 1, Val loss: 0.3715, Val F1: 0.8705
Epoch 2, Val loss: 0.2626, Val F1: 0.9158
Epoch 3, Val loss: 0.2781, Val F1: 0.9120
[I 2026-05-28 17:13:26,106] Trial 13 pruned. 
Epoch 1, Val loss: 0.4053, Val F1: 0.8660
[I 2026-05-28 17:13:31,380] Trial 14 pruned. 
Epoch 1, Val loss: 0.4468, Val F1: 0.8488
[I 2026-05-28 17:13:36,646] Trial 15 pruned. 
Epoch 1, Val loss: 0.7757, Val F1: 0.7220
[I 2026-05-28 17:13:41,696] Trial 16 pruned. 
Epoch 1, Val loss: 0.4087, Val F1: 0.8651
[I 2026-05-28 17:13:49,056] Trial 17 pruned. 
Epoch 1, Val loss: 0.8696, Val F1: 0.6496
[I 2026-05-28 17:13:56,012] Trial 18 pruned. 
Epoch 1, Val loss: 0.3899, Val F1: 0.8768
Epoch 2, Val loss: 0.2261, Val F1: 0.9321
Epoch 3, Val loss: 0.2404, Val F1: 0.9163
Epoch 4, Val loss: 0.1575, Val F1: 0.9499
Epoch 5, Val loss: 0.1495, Val F1: 0.9505
Epoch 6, Val loss: 0.2047, Val F1: 0.9348
Epoch 7, Val loss: 0.1495, Val F1: 0.9520
Epoch 8, Val loss: 0.1767, Val F1: 0.9375
Epoch 9, Val loss: 0.1085, Val F1: 0.9620
Epoch 10, Val loss: 0.1285, Val F1: 0.9595
Epoch 11, Val loss: 0.1202, Val F1: 0.9606
Epoch 12, Val loss: 0.1338, Val F1: 0.9602
Epoch 13, Val loss: 0.1077, Val F1: 0.9666
Epoch 14, Val loss: 0.1350, Val F1: 0.9595
Epoch 15, Val loss: 0.1431, Val F1: 0.9560
Epoch 16, Val loss: 0.1176, Val F1: 0.9651
Epoch 17, Val loss: 0.1361, Val F1: 0.9623
Epoch 18, Val loss: 0.1126, Val F1: 0.9717
Epoch 19, Val loss: 0.1187, Val F1: 0.9700
Epoch 20, Val loss: 0.1331, Val F1: 0.9617
Epoch 21, Val loss: 0.1269, Val F1: 0.9634
Epoch 22, Val loss: 0.1148, Val F1: 0.9680
Epoch 23, Val loss: 0.1410, Val F1: 0.9660
[I 2026-05-28 17:15:59,404] Trial 19 finished with value: 0.9717131920394072 and parameters: {'n_conv_blocks': 3, 'base_channels': 128, 'kernels': 'multi_3_5_7_9', 'n_fc_layers': 3, 'fc_hidden': 512, 'dropout': 0.3533410463744395, 'activation': 'silu', 'lr': 0.00010355459575151963}. Best is trial 12 with value: 0.975298783288449.
Epoch 1, Val loss: 0.3670, Val F1: 0.8801
Epoch 2, Val loss: 0.3366, Val F1: 0.8902
[I 2026-05-28 17:16:05,885] Trial 20 pruned. 
Epoch 1, Val loss: 0.2964, Val F1: 0.9007
Epoch 2, Val loss: 0.2269, Val F1: 0.9291
Epoch 3, Val loss: 0.1957, Val F1: 0.9365
Epoch 4, Val loss: 0.2207, Val F1: 0.9284
Epoch 5, Val loss: 0.1599, Val F1: 0.9450
Epoch 6, Val loss: 0.1565, Val F1: 0.9478
Epoch 7, Val loss: 0.1318, Val F1: 0.9549
Epoch 8, Val loss: 0.1404, Val F1: 0.9546
Epoch 9, Val loss: 0.1246, Val F1: 0.9628
Epoch 10, Val loss: 0.1338, Val F1: 0.9560
Epoch 11, Val loss: 0.1402, Val F1: 0.9560
Epoch 12, Val loss: 0.1051, Val F1: 0.9652
Epoch 13, Val loss: 0.1299, Val F1: 0.9592
Epoch 14, Val loss: 0.1410, Val F1: 0.9578
Epoch 15, Val loss: 0.1360, Val F1: 0.9604
Epoch 16, Val loss: 0.1110, Val F1: 0.9660
Epoch 17, Val loss: 0.1108, Val F1: 0.9708
Epoch 18, Val loss: 0.1142, Val F1: 0.9690
Epoch 19, Val loss: 0.1321, Val F1: 0.9610
Epoch 20, Val loss: 0.1151, Val F1: 0.9679
Epoch 21, Val loss: 0.1100, Val F1: 0.9684
Epoch 22, Val loss: 0.0960, Val F1: 0.9708
[I 2026-05-28 17:18:01,883] Trial 21 finished with value: 0.9708343919511595 and parameters: {'n_conv_blocks': 3, 'base_channels': 128, 'kernels': 'multi_3_5_7_9', 'n_fc_layers': 3, 'fc_hidden': 512, 'dropout': 0.34592969130937984, 'activation': 'silu', 'lr': 0.00010630658415704688}. Best is trial 12 with value: 0.975298783288449.
Epoch 1, Val loss: 0.4103, Val F1: 0.8638
[I 2026-05-28 17:18:09,198] Trial 22 pruned. 
Epoch 1, Val loss: 0.3922, Val F1: 0.8645
[I 2026-05-28 17:18:14,471] Trial 23 pruned. 
Epoch 1, Val loss: 0.3217, Val F1: 0.8904
Epoch 2, Val loss: 0.2236, Val F1: 0.9253
Epoch 3, Val loss: 0.1963, Val F1: 0.9325
Epoch 4, Val loss: 0.1723, Val F1: 0.9411
Epoch 5, Val loss: 0.1753, Val F1: 0.9432
Epoch 6, Val loss: 0.1587, Val F1: 0.9490
Epoch 7, Val loss: 0.1465, Val F1: 0.9523
Epoch 8, Val loss: 0.1643, Val F1: 0.9519
Epoch 9, Val loss: 0.1653, Val F1: 0.9510
[I 2026-05-28 17:18:42,719] Trial 24 pruned. 
Epoch 1, Val loss: 0.3966, Val F1: 0.8714
[I 2026-05-28 17:18:45,887] Trial 25 pruned. 
Epoch 1, Val loss: 0.4353, Val F1: 0.8570
[I 2026-05-28 17:18:51,262] Trial 26 pruned. 
Epoch 1, Val loss: 0.4285, Val F1: 0.8644
[I 2026-05-28 17:18:58,402] Trial 27 pruned. 
Epoch 1, Val loss: 0.7337, Val F1: 0.7333
[I 2026-05-28 17:19:01,195] Trial 28 pruned. 
Epoch 1, Val loss: 0.3855, Val F1: 0.8693
[I 2026-05-28 17:19:04,090] Trial 29 pruned. 
Epoch 1, Val loss: 0.5694, Val F1: 0.8177
Epoch 2, Val loss: 0.2596, Val F1: 0.9125
Epoch 3, Val loss: 0.4142, Val F1: 0.8708
Epoch 4, Val loss: 0.1742, Val F1: 0.9431
Epoch 5, Val loss: 0.2088, Val F1: 0.9325
Epoch 6, Val loss: 0.1373, Val F1: 0.9559
Epoch 7, Val loss: 0.1232, Val F1: 0.9573
Epoch 8, Val loss: 0.1997, Val F1: 0.9289
Epoch 9, Val loss: 0.1155, Val F1: 0.9627
Epoch 10, Val loss: 0.1100, Val F1: 0.9639
Epoch 11, Val loss: 0.1943, Val F1: 0.9376
Epoch 12, Val loss: 0.1114, Val F1: 0.9672
Epoch 13, Val loss: 0.1152, Val F1: 0.9649
Epoch 14, Val loss: 0.1421, Val F1: 0.9563
Epoch 15, Val loss: 0.1373, Val F1: 0.9538
Epoch 16, Val loss: 0.0898, Val F1: 0.9730
Epoch 17, Val loss: 0.1208, Val F1: 0.9601
Epoch 18, Val loss: 0.1302, Val F1: 0.9603
Epoch 19, Val loss: 0.0953, Val F1: 0.9708
Epoch 20, Val loss: 0.0794, Val F1: 0.9762
Epoch 21, Val loss: 0.0918, Val F1: 0.9703
Epoch 22, Val loss: 0.0885, Val F1: 0.9749
Epoch 23, Val loss: 0.1236, Val F1: 0.9606
Epoch 24, Val loss: 0.0891, Val F1: 0.9764
Epoch 25, Val loss: 0.0827, Val F1: 0.9773
Epoch 26, Val loss: 0.0902, Val F1: 0.9705
Epoch 27, Val loss: 0.0839, Val F1: 0.9762
Epoch 28, Val loss: 0.0979, Val F1: 0.9703
Epoch 29, Val loss: 0.0925, Val F1: 0.9736
Epoch 30, Val loss: 0.0872, Val F1: 0.9774
ms: best F1 = 0.9753, params = {'n_conv_blocks': 4, 'base_channels': 128, 'kernels': 'multi_3_5_7_9', 'n_fc_layers': 3, 'fc_hidden': 512, 'dropout': 0.4790204983961076, 'activation': 'silu', 'lr': 0.00013559608187284903}
=== Job finished: Thu May 28 17:22:54 CEST 2026 ===

###############################################################################
Hábrók Cluster
Job 29114330 for user s5964733
Finished at: Thu May 28 17:22:58 CEST 2026

Job details:
============

Job ID                         : 29114330
Name                           : tune_ms
User                           : s5964733
Partition                      : gpushort
Nodes                          : rtx6000gpu1
Number of Nodes                : 1
Cores                          : 8
Number of Tasks                : 1
State                          : COMPLETED  
Submit                         : 2026-05-28T16:54:40
Start                          : 2026-05-28T16:56:33
End                            : 2026-05-28T17:22:54
Reserved walltime              : 04:00:00
Used walltime                  : 00:26:21
Used CPU time                  : 01:02:20 (Efficiency: 29.57%)
% User (Computation)           : 81.30%
% System (I/O)                 : 18.71%
Total memory reserved          : 32G
Maximum memory used            : 7.62G
Requested GPUs                 : rtx_pro_6000=1
Allocated GPUs                 : rtx_pro_6000=1
Max GPU utilization            : 96%
Max GPU memory used            : 2.94G

Acknowledgements:
=================

Please see this page for information about acknowledging Hábrók in your publications:

https://wiki.hpc.rug.nl/habrok/introduction/scientific_output

################################################################################
