=== Job started: Sun May 31 15:15:09 CEST 2026 ===
Node:       rtx6000gpu3
Image type: ms
=== Python: Python 3.12.13 | venv active ===
=== Starting hyperparameter tuning (ms) ===

=== Tuning ms ===
Removed 0 bombay files and 0 jakarta files from SeaLake
[I 2026-05-31 15:15:15,607] A new study created in memory with name: ms
Epoch 1, Val loss: 0.9316, Val F1: 0.6831
Epoch 2, Val loss: 0.5684, Val F1: 0.7985
Epoch 3, Val loss: 0.5356, Val F1: 0.8391
Epoch 4, Val loss: 0.4207, Val F1: 0.8501
Epoch 5, Val loss: 0.2983, Val F1: 0.8971
Epoch 6, Val loss: 0.2529, Val F1: 0.9138
Epoch 7, Val loss: 0.2535, Val F1: 0.9194
Epoch 8, Val loss: 0.2778, Val F1: 0.9183
Epoch 9, Val loss: 0.2292, Val F1: 0.9286
Epoch 10, Val loss: 0.2580, Val F1: 0.9177
Epoch 11, Val loss: 0.2260, Val F1: 0.9272
Epoch 12, Val loss: 0.2376, Val F1: 0.9334
Epoch 13, Val loss: 0.3044, Val F1: 0.9084
Epoch 14, Val loss: 0.2013, Val F1: 0.9390
Epoch 15, Val loss: 0.2003, Val F1: 0.9461
Epoch 16, Val loss: 0.1927, Val F1: 0.9423
Epoch 17, Val loss: 0.2635, Val F1: 0.9317
Epoch 18, Val loss: 0.2119, Val F1: 0.9400
Epoch 19, Val loss: 0.1661, Val F1: 0.9569
Epoch 20, Val loss: 0.2666, Val F1: 0.9437
Epoch 21, Val loss: 0.1782, Val F1: 0.9559
Epoch 22, Val loss: 0.2059, Val F1: 0.9489
Epoch 23, Val loss: 0.2000, Val F1: 0.9507
Epoch 24, Val loss: 0.1828, Val F1: 0.9605
Epoch 25, Val loss: 0.1947, Val F1: 0.9603
Epoch 26, Val loss: 0.2107, Val F1: 0.9478
Epoch 27, Val loss: 0.4076, Val F1: 0.9396
Epoch 28, Val loss: 0.1885, Val F1: 0.9541
Epoch 29, Val loss: 0.1716, Val F1: 0.9608
Epoch 30, Val loss: 0.1593, Val F1: 0.9636
[I 2026-05-31 15:19:37,941] Trial 0 finished with value: 0.9635607273618145 and parameters: {'n_conv_blocks': 4, 'base_channels': 256, 'kernels_block_0': 'single_5', 'kernels_block_1': 'single_3', 'kernels_block_2': 'single_3', 'kernels_block_3': 'single_5', 'n_fc_layers': 1, 'fc_hidden': 1024, 'dropout': 0.21769562799657025, 'activation': 'silu', 'lr': 0.0019796294016289203}. Best is trial 0 with value: 0.9635607273618145.
Epoch 1, Val loss: 1.0052, Val F1: 0.4679
Epoch 2, Val loss: 0.7074, Val F1: 0.6602
Epoch 3, Val loss: 0.5212, Val F1: 0.8274
Epoch 4, Val loss: 0.3913, Val F1: 0.8752
Epoch 5, Val loss: 0.3078, Val F1: 0.9046
Epoch 6, Val loss: 0.3155, Val F1: 0.9015
Epoch 7, Val loss: 0.2445, Val F1: 0.9258
Epoch 8, Val loss: 0.2375, Val F1: 0.9323
Epoch 9, Val loss: 0.2220, Val F1: 0.9388
Epoch 10, Val loss: 0.2241, Val F1: 0.9337
Epoch 11, Val loss: 0.1930, Val F1: 0.9439
Epoch 12, Val loss: 0.2031, Val F1: 0.9462
Epoch 13, Val loss: 0.1775, Val F1: 0.9491
Epoch 14, Val loss: 0.2065, Val F1: 0.9394
Epoch 15, Val loss: 0.2101, Val F1: 0.9388
Epoch 16, Val loss: 0.1851, Val F1: 0.9480
Epoch 17, Val loss: 0.1711, Val F1: 0.9527
Epoch 18, Val loss: 0.1940, Val F1: 0.9492
Epoch 19, Val loss: 0.1696, Val F1: 0.9555
Epoch 20, Val loss: 0.1844, Val F1: 0.9457
Epoch 21, Val loss: 0.1619, Val F1: 0.9560
Epoch 22, Val loss: 0.1705, Val F1: 0.9563
Epoch 23, Val loss: 0.1701, Val F1: 0.9571
Epoch 24, Val loss: 0.1528, Val F1: 0.9589
Epoch 25, Val loss: 0.1720, Val F1: 0.9507
Epoch 26, Val loss: 0.1805, Val F1: 0.9547
Epoch 27, Val loss: 0.1765, Val F1: 0.9572
Epoch 28, Val loss: 0.1584, Val F1: 0.9584
Epoch 29, Val loss: 0.1715, Val F1: 0.9543
[I 2026-05-31 15:21:11,257] Trial 1 finished with value: 0.9589191809372727 and parameters: {'n_conv_blocks': 3, 'base_channels': 16, 'kernels_block_0': 'multi_3_7', 'kernels_block_1': 'multi_3_7', 'kernels_block_2': 'single_5', 'n_fc_layers': 6, 'fc_hidden': 128, 'dropout': 0.2638053610398131, 'activation': 'gelu', 'lr': 0.00021305091969032452}. Best is trial 0 with value: 0.9635607273618145.
Epoch 1, Val loss: 2.2457, Val F1: 0.0440
Epoch 2, Val loss: 2.2297, Val F1: 0.0246
Epoch 3, Val loss: 2.2707, Val F1: 0.0299
Epoch 4, Val loss: 2.1747, Val F1: 0.0584
Epoch 5, Val loss: 2.2502, Val F1: 0.0612
Epoch 6, Val loss: 2.2959, Val F1: 0.0608
Epoch 7, Val loss: 2.1902, Val F1: 0.0815
Epoch 8, Val loss: 2.4199, Val F1: 0.0857
Epoch 9, Val loss: 2.2413, Val F1: 0.1269
Epoch 10, Val loss: 2.3422, Val F1: 0.1247
Epoch 11, Val loss: 2.3740, Val F1: 0.1365
Epoch 12, Val loss: 2.2443, Val F1: 0.1498
Epoch 13, Val loss: 2.1393, Val F1: 0.1429
Epoch 14, Val loss: 2.2016, Val F1: 0.1858
Epoch 15, Val loss: 2.2141, Val F1: 0.1971
Epoch 16, Val loss: 2.1829, Val F1: 0.1488
Epoch 17, Val loss: 1.9300, Val F1: 0.1687
Epoch 18, Val loss: 2.0772, Val F1: 0.1510
Epoch 19, Val loss: 2.0414, Val F1: 0.1735
Epoch 20, Val loss: 1.9882, Val F1: 0.1540
[I 2026-05-31 15:22:14,759] Trial 2 finished with value: 0.1970585779627921 and parameters: {'n_conv_blocks': 3, 'base_channels': 32, 'kernels_block_0': 'multi_3_5_7_9', 'kernels_block_1': 'single_5', 'kernels_block_2': 'single_3', 'n_fc_layers': 7, 'fc_hidden': 128, 'dropout': 0.5843253642992656, 'activation': 'gelu', 'lr': 0.0002656462537261055}. Best is trial 0 with value: 0.9635607273618145.
Epoch 1, Val loss: 0.9691, Val F1: 0.6416
Epoch 2, Val loss: 0.7172, Val F1: 0.7477
Epoch 3, Val loss: 0.4239, Val F1: 0.8553
Epoch 4, Val loss: 0.4333, Val F1: 0.8604
Epoch 5, Val loss: 0.4253, Val F1: 0.8711
Epoch 6, Val loss: 0.3189, Val F1: 0.8913
Epoch 7, Val loss: 0.3247, Val F1: 0.9001
Epoch 8, Val loss: 0.2812, Val F1: 0.9174
Epoch 9, Val loss: 0.1865, Val F1: 0.9443
Epoch 10, Val loss: 0.2133, Val F1: 0.9345
Epoch 11, Val loss: 0.1670, Val F1: 0.9480
Epoch 12, Val loss: 0.1837, Val F1: 0.9421
Epoch 13, Val loss: 0.1849, Val F1: 0.9475
Epoch 14, Val loss: 0.1393, Val F1: 0.9628
Epoch 15, Val loss: 0.1484, Val F1: 0.9534
Epoch 16, Val loss: 0.1552, Val F1: 0.9597
Epoch 17, Val loss: 0.1408, Val F1: 0.9578
Epoch 18, Val loss: 0.1287, Val F1: 0.9639
Epoch 19, Val loss: 0.1478, Val F1: 0.9574
Epoch 20, Val loss: 0.1778, Val F1: 0.9571
Epoch 21, Val loss: 0.1329, Val F1: 0.9643
Epoch 22, Val loss: 0.2204, Val F1: 0.9475
Epoch 23, Val loss: 0.1613, Val F1: 0.9578
Epoch 24, Val loss: 0.1940, Val F1: 0.9557
Epoch 25, Val loss: 0.1764, Val F1: 0.9620
Epoch 26, Val loss: 0.1605, Val F1: 0.9612
[I 2026-05-31 15:23:32,780] Trial 3 finished with value: 0.9642786120252798 and parameters: {'n_conv_blocks': 4, 'base_channels': 64, 'kernels_block_0': 'single_5', 'kernels_block_1': 'single_3', 'kernels_block_2': 'multi_3_5_7_9', 'kernels_block_3': 'multi_3_7', 'n_fc_layers': 1, 'fc_hidden': 128, 'dropout': 0.26732001781925224, 'activation': 'silu', 'lr': 0.0064642459081234675}. Best is trial 3 with value: 0.9642786120252798.
Epoch 1, Val loss: 0.8044, Val F1: 0.6116
Epoch 2, Val loss: 0.5024, Val F1: 0.8391
Epoch 3, Val loss: 0.4178, Val F1: 0.8761
Epoch 4, Val loss: 0.4456, Val F1: 0.8631
Epoch 5, Val loss: 0.2749, Val F1: 0.9154
Epoch 6, Val loss: 0.2209, Val F1: 0.9281
Epoch 7, Val loss: 0.2132, Val F1: 0.9347
Epoch 8, Val loss: 0.1809, Val F1: 0.9420
Epoch 9, Val loss: 0.1974, Val F1: 0.9406
Epoch 10, Val loss: 0.1950, Val F1: 0.9383
Epoch 11, Val loss: 0.2079, Val F1: 0.9398
Epoch 12, Val loss: 0.1780, Val F1: 0.9468
Epoch 13, Val loss: 0.1941, Val F1: 0.9482
Epoch 14, Val loss: 0.2175, Val F1: 0.9392
Epoch 15, Val loss: 0.1895, Val F1: 0.9452
Epoch 16, Val loss: 0.1798, Val F1: 0.9505
Epoch 17, Val loss: 0.1829, Val F1: 0.9499
Epoch 18, Val loss: 0.1671, Val F1: 0.9520
Epoch 19, Val loss: 0.1743, Val F1: 0.9539
Epoch 20, Val loss: 0.1735, Val F1: 0.9507
Epoch 21, Val loss: 0.1901, Val F1: 0.9488
Epoch 22, Val loss: 0.2096, Val F1: 0.9423
Epoch 23, Val loss: 0.1596, Val F1: 0.9582
Epoch 24, Val loss: 0.2023, Val F1: 0.9495
Epoch 25, Val loss: 0.1669, Val F1: 0.9556
Epoch 26, Val loss: 0.1628, Val F1: 0.9528
Epoch 27, Val loss: 0.1959, Val F1: 0.9528
Epoch 28, Val loss: 0.2304, Val F1: 0.9483
[I 2026-05-31 15:24:51,376] Trial 4 finished with value: 0.9581680704780091 and parameters: {'n_conv_blocks': 3, 'base_channels': 16, 'kernels_block_0': 'multi_3_7', 'kernels_block_1': 'multi_3_5_7_9', 'kernels_block_2': 'multi_3_7', 'n_fc_layers': 7, 'fc_hidden': 1024, 'dropout': 0.537437135378311, 'activation': 'silu', 'lr': 0.00019003263616443358}. Best is trial 3 with value: 0.9642786120252798.
Epoch 1, Val loss: 1.4905, Val F1: 0.3668
[I 2026-05-31 15:24:54,112] Trial 5 pruned. 
Epoch 1, Val loss: 0.4323, Val F1: 0.8462
Epoch 2, Val loss: 0.2674, Val F1: 0.9095
Epoch 3, Val loss: 0.2932, Val F1: 0.9012
Epoch 4, Val loss: 0.2553, Val F1: 0.9155
Epoch 5, Val loss: 0.1995, Val F1: 0.9325
Epoch 6, Val loss: 0.2238, Val F1: 0.9329
Epoch 7, Val loss: 0.1876, Val F1: 0.9368
Epoch 8, Val loss: 0.1763, Val F1: 0.9374
Epoch 9, Val loss: 0.1652, Val F1: 0.9436
Epoch 10, Val loss: 0.1433, Val F1: 0.9571
Epoch 11, Val loss: 0.1566, Val F1: 0.9486
Epoch 12, Val loss: 0.1538, Val F1: 0.9526
Epoch 13, Val loss: 0.1685, Val F1: 0.9441
Epoch 14, Val loss: 0.1344, Val F1: 0.9602
Epoch 15, Val loss: 0.1564, Val F1: 0.9499
Epoch 16, Val loss: 0.1373, Val F1: 0.9584
Epoch 17, Val loss: 0.1473, Val F1: 0.9513
Epoch 18, Val loss: 0.1238, Val F1: 0.9614
Epoch 19, Val loss: 0.1723, Val F1: 0.9460
Epoch 20, Val loss: 0.1376, Val F1: 0.9594
Epoch 21, Val loss: 0.1681, Val F1: 0.9523
Epoch 22, Val loss: 0.1683, Val F1: 0.9546
Epoch 23, Val loss: 0.1922, Val F1: 0.9512
[I 2026-05-31 15:26:25,975] Trial 6 finished with value: 0.9613845204435403 and parameters: {'n_conv_blocks': 2, 'base_channels': 128, 'kernels_block_0': 'multi_3_5_7_9', 'kernels_block_1': 'multi_3_5', 'n_fc_layers': 3, 'fc_hidden': 1024, 'dropout': 0.43122153867331287, 'activation': 'relu', 'lr': 0.00018224528038240725}. Best is trial 3 with value: 0.9642786120252798.
Epoch 1, Val loss: 0.4875, Val F1: 0.8304
Epoch 2, Val loss: 0.3755, Val F1: 0.8701
Epoch 3, Val loss: 0.2189, Val F1: 0.9273
Epoch 4, Val loss: 0.1922, Val F1: 0.9374
Epoch 5, Val loss: 0.2028, Val F1: 0.9343
Epoch 6, Val loss: 0.2498, Val F1: 0.9216
Epoch 7, Val loss: 0.2046, Val F1: 0.9364
Epoch 8, Val loss: 0.1733, Val F1: 0.9423
Epoch 9, Val loss: 0.1669, Val F1: 0.9444
Epoch 10, Val loss: 0.1664, Val F1: 0.9472
Epoch 11, Val loss: 0.1857, Val F1: 0.9446
Epoch 12, Val loss: 0.1457, Val F1: 0.9566
Epoch 13, Val loss: 0.1447, Val F1: 0.9559
Epoch 14, Val loss: 0.1283, Val F1: 0.9617
Epoch 15, Val loss: 0.1376, Val F1: 0.9627
Epoch 16, Val loss: 0.1491, Val F1: 0.9521
Epoch 17, Val loss: 0.1424, Val F1: 0.9573
Epoch 18, Val loss: 0.1714, Val F1: 0.9560
Epoch 19, Val loss: 0.1358, Val F1: 0.9592
Epoch 20, Val loss: 0.1353, Val F1: 0.9623
[I 2026-05-31 15:27:21,587] Trial 7 finished with value: 0.9626855658593663 and parameters: {'n_conv_blocks': 4, 'base_channels': 16, 'kernels_block_0': 'multi_3_7', 'kernels_block_1': 'single_5', 'kernels_block_2': 'multi_3_5_7_9', 'kernels_block_3': 'multi_3_5_7_9', 'n_fc_layers': 4, 'fc_hidden': 128, 'dropout': 0.24307339028444017, 'activation': 'gelu', 'lr': 0.00021469845393394212}. Best is trial 3 with value: 0.9642786120252798.
Epoch 1, Val loss: 1.1121, Val F1: 0.5321
[I 2026-05-31 15:27:24,447] Trial 8 pruned. 
Epoch 1, Val loss: 2.1188, Val F1: 0.0799
[I 2026-05-31 15:27:31,150] Trial 9 pruned. 
Epoch 1, Val loss: 0.4391, Val F1: 0.8359
Epoch 2, Val loss: 0.2655, Val F1: 0.9111
Epoch 3, Val loss: 0.2289, Val F1: 0.9199
Epoch 4, Val loss: 0.2530, Val F1: 0.9115
Epoch 5, Val loss: 0.1766, Val F1: 0.9372
Epoch 6, Val loss: 0.1728, Val F1: 0.9395
Epoch 7, Val loss: 0.1968, Val F1: 0.9327
Epoch 8, Val loss: 0.1468, Val F1: 0.9505
Epoch 9, Val loss: 0.1573, Val F1: 0.9466
Epoch 10, Val loss: 0.1233, Val F1: 0.9604
Epoch 11, Val loss: 0.1241, Val F1: 0.9588
Epoch 12, Val loss: 0.1434, Val F1: 0.9509
Epoch 13, Val loss: 0.1520, Val F1: 0.9551
Epoch 14, Val loss: 0.1308, Val F1: 0.9617
Epoch 15, Val loss: 0.1034, Val F1: 0.9711
Epoch 16, Val loss: 0.1312, Val F1: 0.9546
Epoch 17, Val loss: 0.1086, Val F1: 0.9632
Epoch 18, Val loss: 0.1105, Val F1: 0.9667
Epoch 19, Val loss: 0.1387, Val F1: 0.9570
Epoch 20, Val loss: 0.1198, Val F1: 0.9614
[I 2026-05-31 15:28:27,045] Trial 10 finished with value: 0.9710649967017855 and parameters: {'n_conv_blocks': 4, 'base_channels': 64, 'kernels_block_0': 'single_5', 'kernels_block_1': 'single_3', 'kernels_block_2': 'multi_3_5_7_9', 'kernels_block_3': 'multi_3_7', 'n_fc_layers': 1, 'fc_hidden': 64, 'dropout': 0.3332294412195043, 'activation': 'silu', 'lr': 0.0006140967037864811}. Best is trial 10 with value: 0.9710649967017855.
Epoch 1, Val loss: 0.4567, Val F1: 0.8387
Epoch 2, Val loss: 0.3284, Val F1: 0.8952
Epoch 3, Val loss: 0.3564, Val F1: 0.8739
Epoch 4, Val loss: 0.1822, Val F1: 0.9412
Epoch 5, Val loss: 0.1881, Val F1: 0.9417
Epoch 6, Val loss: 0.1466, Val F1: 0.9530
Epoch 7, Val loss: 0.1633, Val F1: 0.9500
Epoch 8, Val loss: 0.2163, Val F1: 0.9351
Epoch 9, Val loss: 0.1678, Val F1: 0.9459
Epoch 10, Val loss: 0.1285, Val F1: 0.9585
Epoch 11, Val loss: 0.1431, Val F1: 0.9519
Epoch 12, Val loss: 0.1342, Val F1: 0.9550
Epoch 13, Val loss: 0.1635, Val F1: 0.9495
Epoch 14, Val loss: 0.1359, Val F1: 0.9586
Epoch 15, Val loss: 0.1167, Val F1: 0.9635
Epoch 16, Val loss: 0.1122, Val F1: 0.9684
Epoch 17, Val loss: 0.0988, Val F1: 0.9680
Epoch 18, Val loss: 0.1414, Val F1: 0.9625
Epoch 19, Val loss: 0.1033, Val F1: 0.9685
Epoch 20, Val loss: 0.1126, Val F1: 0.9676
Epoch 21, Val loss: 0.1102, Val F1: 0.9639
Epoch 22, Val loss: 0.1069, Val F1: 0.9735
Epoch 23, Val loss: 0.1005, Val F1: 0.9699
Epoch 24, Val loss: 0.1083, Val F1: 0.9677
Epoch 25, Val loss: 0.1223, Val F1: 0.9674
Epoch 26, Val loss: 0.0963, Val F1: 0.9735
Epoch 27, Val loss: 0.1130, Val F1: 0.9688
[I 2026-05-31 15:29:42,379] Trial 11 finished with value: 0.9735454611142842 and parameters: {'n_conv_blocks': 4, 'base_channels': 64, 'kernels_block_0': 'single_5', 'kernels_block_1': 'single_3', 'kernels_block_2': 'multi_3_5_7_9', 'kernels_block_3': 'multi_3_7', 'n_fc_layers': 1, 'fc_hidden': 64, 'dropout': 0.3264732966943868, 'activation': 'silu', 'lr': 0.0006896121262761433}. Best is trial 11 with value: 0.9735454611142842.
Epoch 1, Val loss: 0.7518, Val F1: 0.7530
Epoch 2, Val loss: 0.3920, Val F1: 0.8770
Epoch 3, Val loss: 0.2785, Val F1: 0.9163
Epoch 4, Val loss: 0.2170, Val F1: 0.9378
Epoch 5, Val loss: 0.2165, Val F1: 0.9330
Epoch 6, Val loss: 0.4643, Val F1: 0.8812
Epoch 7, Val loss: 0.1558, Val F1: 0.9525
Epoch 8, Val loss: 0.1835, Val F1: 0.9457
Epoch 9, Val loss: 0.2176, Val F1: 0.9387
Epoch 10, Val loss: 0.1881, Val F1: 0.9488
Epoch 11, Val loss: 0.1469, Val F1: 0.9551
Epoch 12, Val loss: 0.1201, Val F1: 0.9605
Epoch 13, Val loss: 0.1326, Val F1: 0.9588
Epoch 14, Val loss: 0.1462, Val F1: 0.9550
Epoch 15, Val loss: 0.1644, Val F1: 0.9522
Epoch 16, Val loss: 0.1103, Val F1: 0.9658
Epoch 17, Val loss: 0.1052, Val F1: 0.9706
Epoch 18, Val loss: 0.1151, Val F1: 0.9651
Epoch 19, Val loss: 0.1198, Val F1: 0.9681
Epoch 20, Val loss: 0.1072, Val F1: 0.9714
Epoch 21, Val loss: 0.1300, Val F1: 0.9645
Epoch 22, Val loss: 0.1107, Val F1: 0.9706
Epoch 23, Val loss: 0.1320, Val F1: 0.9628
Epoch 24, Val loss: 0.1553, Val F1: 0.9552
Epoch 25, Val loss: 0.1003, Val F1: 0.9732
Epoch 26, Val loss: 0.1140, Val F1: 0.9702
Epoch 27, Val loss: 0.1060, Val F1: 0.9703
Epoch 28, Val loss: 0.1271, Val F1: 0.9669
Epoch 29, Val loss: 0.1292, Val F1: 0.9720
Epoch 30, Val loss: 0.1254, Val F1: 0.9709
[I 2026-05-31 15:31:04,352] Trial 12 finished with value: 0.9732354011699715 and parameters: {'n_conv_blocks': 4, 'base_channels': 64, 'kernels_block_0': 'multi_3_5', 'kernels_block_1': 'single_3', 'kernels_block_2': 'multi_3_5', 'kernels_block_3': 'multi_3_7', 'n_fc_layers': 3, 'fc_hidden': 64, 'dropout': 0.335964434722964, 'activation': 'silu', 'lr': 0.0005605381413435708}. Best is trial 11 with value: 0.9735454611142842.
Epoch 1, Val loss: 0.7865, Val F1: 0.6766
[I 2026-05-31 15:31:07,078] Trial 13 pruned. 
Epoch 1, Val loss: 0.6797, Val F1: 0.7099
[I 2026-05-31 15:31:09,798] Trial 14 pruned. 
Epoch 1, Val loss: 0.7353, Val F1: 0.7435
Epoch 2, Val loss: 0.5019, Val F1: 0.8434
[I 2026-05-31 15:31:15,156] Trial 15 pruned. 
Epoch 1, Val loss: 0.3793, Val F1: 0.8583
Epoch 2, Val loss: 0.2353, Val F1: 0.9232
Epoch 3, Val loss: 0.2630, Val F1: 0.9072
Epoch 4, Val loss: 0.1861, Val F1: 0.9387
Epoch 5, Val loss: 0.1928, Val F1: 0.9328
Epoch 6, Val loss: 0.1569, Val F1: 0.9477
Epoch 7, Val loss: 0.1833, Val F1: 0.9450
Epoch 8, Val loss: 0.1470, Val F1: 0.9551
Epoch 9, Val loss: 0.1438, Val F1: 0.9538
Epoch 10, Val loss: 0.1728, Val F1: 0.9425
Epoch 11, Val loss: 0.1525, Val F1: 0.9521
Epoch 12, Val loss: 0.1685, Val F1: 0.9498
Epoch 13, Val loss: 0.1518, Val F1: 0.9558
Epoch 14, Val loss: 0.1085, Val F1: 0.9644
Epoch 15, Val loss: 0.1354, Val F1: 0.9558
Epoch 16, Val loss: 0.1206, Val F1: 0.9616
Epoch 17, Val loss: 0.1355, Val F1: 0.9581
Epoch 18, Val loss: 0.1180, Val F1: 0.9634
Epoch 19, Val loss: 0.1369, Val F1: 0.9555
[I 2026-05-31 15:32:06,621] Trial 16 finished with value: 0.9643892061207131 and parameters: {'n_conv_blocks': 4, 'base_channels': 32, 'kernels_block_0': 'multi_3_5', 'kernels_block_1': 'single_3', 'kernels_block_2': 'single_5', 'kernels_block_3': 'single_3', 'n_fc_layers': 2, 'fc_hidden': 512, 'dropout': 0.4903281027817574, 'activation': 'relu', 'lr': 0.0003827622789447926}. Best is trial 11 with value: 0.9735454611142842.
Epoch 1, Val loss: 0.6145, Val F1: 0.7856
Epoch 2, Val loss: 0.5432, Val F1: 0.8284
[I 2026-05-31 15:32:12,070] Trial 17 pruned. 
Epoch 1, Val loss: 0.4476, Val F1: 0.8541
Epoch 2, Val loss: 0.3059, Val F1: 0.9013
Epoch 3, Val loss: 0.2251, Val F1: 0.9284
Epoch 4, Val loss: 0.2501, Val F1: 0.9229
Epoch 5, Val loss: 0.2350, Val F1: 0.9159
[I 2026-05-31 15:32:25,834] Trial 18 pruned. 
Epoch 1, Val loss: 1.2988, Val F1: 0.4320
[I 2026-05-31 15:32:29,022] Trial 19 pruned. 
Epoch 1, Val loss: 2.0263, Val F1: 0.1178
[I 2026-05-31 15:32:32,206] Trial 20 pruned. 
Epoch 1, Val loss: 0.3916, Val F1: 0.8704
Epoch 2, Val loss: 0.3072, Val F1: 0.8911
Epoch 3, Val loss: 0.2167, Val F1: 0.9276
Epoch 4, Val loss: 0.2448, Val F1: 0.9153
Epoch 5, Val loss: 0.1807, Val F1: 0.9371
Epoch 6, Val loss: 0.1902, Val F1: 0.9344
Epoch 7, Val loss: 0.1665, Val F1: 0.9458
Epoch 8, Val loss: 0.1961, Val F1: 0.9398
Epoch 9, Val loss: 0.1687, Val F1: 0.9455
Epoch 10, Val loss: 0.1309, Val F1: 0.9551
Epoch 11, Val loss: 0.1416, Val F1: 0.9499
Epoch 12, Val loss: 0.1227, Val F1: 0.9596
Epoch 13, Val loss: 0.1087, Val F1: 0.9669
Epoch 14, Val loss: 0.1266, Val F1: 0.9605
Epoch 15, Val loss: 0.1177, Val F1: 0.9595
Epoch 16, Val loss: 0.1187, Val F1: 0.9623
Epoch 17, Val loss: 0.1165, Val F1: 0.9613
Epoch 18, Val loss: 0.1004, Val F1: 0.9709
Epoch 19, Val loss: 0.1159, Val F1: 0.9632
Epoch 20, Val loss: 0.1040, Val F1: 0.9679
Epoch 21, Val loss: 0.0961, Val F1: 0.9718
Epoch 22, Val loss: 0.1093, Val F1: 0.9686
Epoch 23, Val loss: 0.1202, Val F1: 0.9647
Epoch 24, Val loss: 0.1187, Val F1: 0.9649
Epoch 25, Val loss: 0.0993, Val F1: 0.9710
Epoch 26, Val loss: 0.0959, Val F1: 0.9758
Epoch 27, Val loss: 0.1351, Val F1: 0.9637
Epoch 28, Val loss: 0.1078, Val F1: 0.9703
Epoch 29, Val loss: 0.1226, Val F1: 0.9663
Epoch 30, Val loss: 0.1130, Val F1: 0.9722
[I 2026-05-31 15:33:54,752] Trial 21 finished with value: 0.9757648393386523 and parameters: {'n_conv_blocks': 4, 'base_channels': 64, 'kernels_block_0': 'single_5', 'kernels_block_1': 'single_3', 'kernels_block_2': 'multi_3_5_7_9', 'kernels_block_3': 'multi_3_7', 'n_fc_layers': 1, 'fc_hidden': 64, 'dropout': 0.327999272896116, 'activation': 'silu', 'lr': 0.0005763173899071285}. Best is trial 21 with value: 0.9757648393386523.
Epoch 1, Val loss: 0.6359, Val F1: 0.7720
[I 2026-05-31 15:33:57,526] Trial 22 pruned. 
Epoch 1, Val loss: 0.4081, Val F1: 0.8723
Epoch 2, Val loss: 0.2988, Val F1: 0.9011
Epoch 3, Val loss: 0.2224, Val F1: 0.9304
Epoch 4, Val loss: 0.2269, Val F1: 0.9263
Epoch 5, Val loss: 0.2110, Val F1: 0.9286
[I 2026-05-31 15:34:11,208] Trial 23 pruned. 
Epoch 1, Val loss: 0.5749, Val F1: 0.8027
Epoch 2, Val loss: 0.2790, Val F1: 0.9090
Epoch 3, Val loss: 0.2130, Val F1: 0.9290
Epoch 4, Val loss: 0.2286, Val F1: 0.9264
Epoch 5, Val loss: 0.2080, Val F1: 0.9356
Epoch 6, Val loss: 0.1856, Val F1: 0.9382
Epoch 7, Val loss: 0.2131, Val F1: 0.9275
Epoch 8, Val loss: 0.1316, Val F1: 0.9574
Epoch 9, Val loss: 0.1305, Val F1: 0.9559
Epoch 10, Val loss: 0.1322, Val F1: 0.9582
Epoch 11, Val loss: 0.1162, Val F1: 0.9653
Epoch 12, Val loss: 0.1325, Val F1: 0.9573
Epoch 13, Val loss: 0.1194, Val F1: 0.9609
Epoch 14, Val loss: 0.1211, Val F1: 0.9620
Epoch 15, Val loss: 0.1245, Val F1: 0.9606
Epoch 16, Val loss: 0.1083, Val F1: 0.9660
Epoch 17, Val loss: 0.1683, Val F1: 0.9490
Epoch 18, Val loss: 0.1027, Val F1: 0.9680
Epoch 19, Val loss: 0.1109, Val F1: 0.9690
Epoch 20, Val loss: 0.1195, Val F1: 0.9623
Epoch 21, Val loss: 0.0902, Val F1: 0.9740
Epoch 22, Val loss: 0.0887, Val F1: 0.9727
Epoch 23, Val loss: 0.1098, Val F1: 0.9671
Epoch 24, Val loss: 0.1027, Val F1: 0.9705
Epoch 25, Val loss: 0.0841, Val F1: 0.9750
Epoch 26, Val loss: 0.0875, Val F1: 0.9728
Epoch 27, Val loss: 0.0828, Val F1: 0.9763
Epoch 28, Val loss: 0.1421, Val F1: 0.9596
Epoch 29, Val loss: 0.0931, Val F1: 0.9721
Epoch 30, Val loss: 0.0937, Val F1: 0.9691
