=== Job started: Sun Jun  7 22:07:59 CEST 2026 ===
Node:       rtx6000gpu2
Image type: rgb
N trials:   100
=== Python: Python 3.12.13 | venv active ===
=== Starting hyperparameter tuning (rgb) ===

=== Tuning rgb ===
Removed 0 bombay files and 0 jakarta files from SeaLake
[I 2026-06-07 22:08:17,202] A new study created in memory with name: rgb
Epoch 1, Val loss: 1.8790, Val F1: 0.3776
Epoch 2, Val loss: 0.5919, Val F1: 0.7738
Epoch 3, Val loss: 1.2717, Val F1: 0.6026
Epoch 4, Val loss: 1.6182, Val F1: 0.5418
Epoch 5, Val loss: 0.5966, Val F1: 0.8037
Epoch 6, Val loss: 0.4781, Val F1: 0.8396
Epoch 7, Val loss: 1.0933, Val F1: 0.6777
Epoch 8, Val loss: 0.3917, Val F1: 0.8686
Epoch 9, Val loss: 0.4320, Val F1: 0.8576
Epoch 10, Val loss: 1.9093, Val F1: 0.5978
Epoch 11, Val loss: 0.7736, Val F1: 0.7435
Epoch 12, Val loss: 0.4354, Val F1: 0.8669
Epoch 13, Val loss: 0.4788, Val F1: 0.8764
Epoch 14, Val loss: 0.4581, Val F1: 0.8576
Epoch 15, Val loss: 0.7155, Val F1: 0.7837
Epoch 16, Val loss: 0.4648, Val F1: 0.8581
Epoch 17, Val loss: 1.5547, Val F1: 0.6353
Epoch 18, Val loss: 0.7410, Val F1: 0.8217
[I 2026-06-07 22:09:14,352] Trial 0 finished with value: 0.8764133018735878 and parameters: {'n_conv_blocks': 4, 'base_channels': 64, 'kernels_block_0': 'single_3', 'kernels_block_1': 'single_5', 'kernels_block_2': 'multi_3_7', 'kernels_block_3': 'multi_3_5_7_9', 'n_fc_layers': 4, 'fc_hidden': 1024, 'dropout': 0.5437911998515852, 'activation': 'silu', 'lr': 0.0006515332893235748}. Best is trial 0 with value: 0.8764133018735878.
Epoch 1, Val loss: 1.5967, Val F1: 0.1959
Epoch 2, Val loss: 1.3702, Val F1: 0.3752
Epoch 3, Val loss: 1.4240, Val F1: 0.3883
Epoch 4, Val loss: 1.6095, Val F1: 0.4020
Epoch 5, Val loss: 1.3005, Val F1: 0.5404
Epoch 6, Val loss: 1.0184, Val F1: 0.5973
Epoch 7, Val loss: 1.0010, Val F1: 0.6241
Epoch 8, Val loss: 1.1024, Val F1: 0.5810
Epoch 9, Val loss: 1.9868, Val F1: 0.3797
Epoch 10, Val loss: 1.1510, Val F1: 0.5760
Epoch 11, Val loss: 1.0735, Val F1: 0.6086
Epoch 12, Val loss: 0.8784, Val F1: 0.7002
Epoch 13, Val loss: 1.0381, Val F1: 0.6047
Epoch 14, Val loss: 0.8976, Val F1: 0.6976
Epoch 15, Val loss: 0.8157, Val F1: 0.6997
Epoch 16, Val loss: 1.6564, Val F1: 0.4473
Epoch 17, Val loss: 0.8424, Val F1: 0.7062
Epoch 18, Val loss: 0.6657, Val F1: 0.7845
Epoch 19, Val loss: 1.0057, Val F1: 0.6971
Epoch 20, Val loss: 0.6304, Val F1: 0.7774
Epoch 21, Val loss: 2.3210, Val F1: 0.4309
Epoch 22, Val loss: 0.8285, Val F1: 0.7185
Epoch 23, Val loss: 0.6592, Val F1: 0.8148
Epoch 24, Val loss: 0.5457, Val F1: 0.8415
Epoch 25, Val loss: 0.9194, Val F1: 0.7330
Epoch 26, Val loss: 0.5337, Val F1: 0.8434
Epoch 27, Val loss: 0.5756, Val F1: 0.8156
Epoch 28, Val loss: 0.5033, Val F1: 0.8407
Epoch 29, Val loss: 0.8770, Val F1: 0.7255
Epoch 30, Val loss: 0.8274, Val F1: 0.7446
[I 2026-06-07 22:10:09,078] Trial 1 finished with value: 0.8434067532387142 and parameters: {'n_conv_blocks': 6, 'base_channels': 16, 'kernels_block_0': 'multi_3_5', 'kernels_block_1': 'single_3', 'kernels_block_2': 'multi_3_5', 'kernels_block_3': 'multi_3_5', 'kernels_block_4': 'single_5', 'kernels_block_5': 'single_5', 'n_fc_layers': 7, 'fc_hidden': 1024, 'dropout': 0.547635893948984, 'activation': 'relu', 'lr': 0.0010810665972582072}. Best is trial 0 with value: 0.8764133018735878.
Epoch 1, Val loss: 2.3113, Val F1: 0.1572
Epoch 2, Val loss: 2.6320, Val F1: 0.1077
Epoch 3, Val loss: 1.9707, Val F1: 0.1444
Epoch 4, Val loss: 1.5966, Val F1: 0.2956
Epoch 5, Val loss: 1.6115, Val F1: 0.2287
Epoch 6, Val loss: 1.7586, Val F1: 0.2268
Epoch 7, Val loss: 1.5657, Val F1: 0.3583
Epoch 8, Val loss: 1.7036, Val F1: 0.1957
Epoch 9, Val loss: 1.4829, Val F1: 0.3287
Epoch 10, Val loss: 1.3895, Val F1: 0.4648
Epoch 11, Val loss: 1.4764, Val F1: 0.3264
Epoch 12, Val loss: 1.5819, Val F1: 0.3364
Epoch 13, Val loss: 1.2611, Val F1: 0.4903
Epoch 14, Val loss: 1.6461, Val F1: 0.3338
Epoch 15, Val loss: 1.7316, Val F1: 0.2619
Epoch 16, Val loss: 1.4061, Val F1: 0.3861
Epoch 17, Val loss: 1.4137, Val F1: 0.3977
Epoch 18, Val loss: 1.4615, Val F1: 0.3780
[I 2026-06-07 22:10:40,796] Trial 2 finished with value: 0.49029188456811285 and parameters: {'n_conv_blocks': 3, 'base_channels': 16, 'kernels_block_0': 'multi_3_7', 'kernels_block_1': 'single_5', 'kernels_block_2': 'multi_3_5_7_9', 'n_fc_layers': 3, 'fc_hidden': 64, 'dropout': 0.5137106723635547, 'activation': 'relu', 'lr': 0.0032612362310797693}. Best is trial 0 with value: 0.8764133018735878.
Epoch 1, Val loss: 4.9558, Val F1: 0.2065
Epoch 2, Val loss: 1.1067, Val F1: 0.5619
Epoch 3, Val loss: 1.3120, Val F1: 0.5677
Epoch 4, Val loss: 1.2043, Val F1: 0.6480
Epoch 5, Val loss: 4.3444, Val F1: 0.2660
Epoch 6, Val loss: 2.2469, Val F1: 0.4177
Epoch 7, Val loss: 1.2332, Val F1: 0.6420
Epoch 8, Val loss: 0.6583, Val F1: 0.7645
Epoch 9, Val loss: 1.3203, Val F1: 0.6465
Epoch 10, Val loss: 5.6614, Val F1: 0.3076
Epoch 11, Val loss: 3.1263, Val F1: 0.5030
Epoch 12, Val loss: 2.5481, Val F1: 0.4907
Epoch 13, Val loss: 0.4836, Val F1: 0.8494
Epoch 14, Val loss: 1.6080, Val F1: 0.6299
Epoch 15, Val loss: 0.5353, Val F1: 0.8416
Epoch 16, Val loss: 1.4122, Val F1: 0.6797
Epoch 17, Val loss: 0.3507, Val F1: 0.9019
Epoch 18, Val loss: 0.3450, Val F1: 0.8909
Epoch 19, Val loss: 0.3060, Val F1: 0.9243
Epoch 20, Val loss: 0.3194, Val F1: 0.9024
Epoch 21, Val loss: 0.6845, Val F1: 0.8538
Epoch 22, Val loss: 4.5689, Val F1: 0.5936
Epoch 23, Val loss: 0.4833, Val F1: 0.8939
Epoch 24, Val loss: 0.4929, Val F1: 0.8562
[I 2026-06-07 22:11:34,306] Trial 3 finished with value: 0.9242633348592925 and parameters: {'n_conv_blocks': 4, 'base_channels': 64, 'kernels_block_0': 'multi_3_7', 'kernels_block_1': 'multi_3_5', 'kernels_block_2': 'single_5', 'kernels_block_3': 'multi_3_5_7_9', 'n_fc_layers': 1, 'fc_hidden': 128, 'dropout': 0.22091088287596597, 'activation': 'gelu', 'lr': 0.0058646437367304355}. Best is trial 3 with value: 0.9242633348592925.
Epoch 1, Val loss: 0.9837, Val F1: 0.6301
Epoch 2, Val loss: 1.2727, Val F1: 0.6153
Epoch 3, Val loss: 0.7276, Val F1: 0.7083
Epoch 4, Val loss: 0.7104, Val F1: 0.7540
Epoch 5, Val loss: 0.7205, Val F1: 0.7147
Epoch 6, Val loss: 0.3808, Val F1: 0.8587
Epoch 7, Val loss: 0.8635, Val F1: 0.7539
Epoch 8, Val loss: 1.8481, Val F1: 0.6025
Epoch 9, Val loss: 1.8656, Val F1: 0.5766
Epoch 10, Val loss: 0.4110, Val F1: 0.8520
Epoch 11, Val loss: 0.3169, Val F1: 0.8910
Epoch 12, Val loss: 0.3258, Val F1: 0.8775
Epoch 13, Val loss: 1.4227, Val F1: 0.6415
Epoch 14, Val loss: 0.4361, Val F1: 0.8533
Epoch 15, Val loss: 0.3335, Val F1: 0.8929
Epoch 16, Val loss: 0.6141, Val F1: 0.8282
Epoch 17, Val loss: 0.5115, Val F1: 0.8490
Epoch 18, Val loss: 0.7289, Val F1: 0.8377
Epoch 19, Val loss: 0.5851, Val F1: 0.8193
Epoch 20, Val loss: 0.2544, Val F1: 0.9213
Epoch 21, Val loss: 0.3283, Val F1: 0.8901
Epoch 22, Val loss: 0.5673, Val F1: 0.8445
Epoch 23, Val loss: 0.4247, Val F1: 0.8882
Epoch 24, Val loss: 0.3003, Val F1: 0.9045
Epoch 25, Val loss: 0.2399, Val F1: 0.9323
Epoch 26, Val loss: 0.6444, Val F1: 0.8315
Epoch 27, Val loss: 0.7121, Val F1: 0.8135
Epoch 28, Val loss: 0.5983, Val F1: 0.8524
Epoch 29, Val loss: 0.2855, Val F1: 0.9220
Epoch 30, Val loss: 0.4673, Val F1: 0.8597
[I 2026-06-07 22:12:27,181] Trial 4 finished with value: 0.9322999117316391 and parameters: {'n_conv_blocks': 4, 'base_channels': 32, 'kernels_block_0': 'multi_3_5_7_9', 'kernels_block_1': 'multi_3_7', 'kernels_block_2': 'single_5', 'kernels_block_3': 'single_5', 'n_fc_layers': 1, 'fc_hidden': 128, 'dropout': 0.41922935328046007, 'activation': 'silu', 'lr': 0.0005559911590943632}. Best is trial 4 with value: 0.9322999117316391.
Epoch 1, Val loss: 1.4512, Val F1: 0.2606
Epoch 2, Val loss: 1.7307, Val F1: 0.1915
[I 2026-06-07 22:12:31,310] Trial 5 pruned. 
Epoch 1, Val loss: 1.3767, Val F1: 0.3500
Epoch 2, Val loss: 1.1084, Val F1: 0.5416
[I 2026-06-07 22:12:34,820] Trial 6 pruned. 
Epoch 1, Val loss: 1.2206, Val F1: 0.5461
Epoch 2, Val loss: 0.7474, Val F1: 0.7040
Epoch 3, Val loss: 0.7095, Val F1: 0.7626
Epoch 4, Val loss: 0.5471, Val F1: 0.7908
Epoch 5, Val loss: 1.3768, Val F1: 0.6273
Epoch 6, Val loss: 3.1056, Val F1: 0.4202
Epoch 7, Val loss: 2.9578, Val F1: 0.4040
Epoch 8, Val loss: 1.1850, Val F1: 0.7195
Epoch 9, Val loss: 0.3909, Val F1: 0.8602
Epoch 10, Val loss: 1.1760, Val F1: 0.6895
Epoch 11, Val loss: 1.1915, Val F1: 0.7265
Epoch 12, Val loss: 0.4904, Val F1: 0.8462
Epoch 13, Val loss: 1.0474, Val F1: 0.7242
Epoch 14, Val loss: 0.9483, Val F1: 0.7026
[I 2026-06-07 22:12:59,719] Trial 7 finished with value: 0.8602086371990388 and parameters: {'n_conv_blocks': 5, 'base_channels': 64, 'kernels_block_0': 'multi_3_7', 'kernels_block_1': 'single_3', 'kernels_block_2': 'single_3', 'kernels_block_3': 'single_3', 'kernels_block_4': 'multi_3_5', 'n_fc_layers': 1, 'fc_hidden': 64, 'dropout': 0.23917680783384748, 'activation': 'silu', 'lr': 0.0029360821095158196}. Best is trial 4 with value: 0.9322999117316391.
Epoch 1, Val loss: 1.4735, Val F1: 0.3902
Epoch 2, Val loss: 1.2040, Val F1: 0.4332
[I 2026-06-07 22:13:03,760] Trial 8 pruned. 
Epoch 1, Val loss: 1.4464, Val F1: 0.4316
Epoch 2, Val loss: 1.8211, Val F1: 0.3947
[I 2026-06-07 22:13:12,224] Trial 9 pruned. 
Epoch 1, Val loss: 1.2238, Val F1: 0.5604
Epoch 2, Val loss: 0.9637, Val F1: 0.6281
Epoch 3, Val loss: 0.7711, Val F1: 0.7216
Epoch 4, Val loss: 0.7133, Val F1: 0.7396
Epoch 5, Val loss: 0.6678, Val F1: 0.7498
Epoch 6, Val loss: 0.7973, Val F1: 0.7275
Epoch 7, Val loss: 0.6074, Val F1: 0.7857
Epoch 8, Val loss: 0.5584, Val F1: 0.8023
Epoch 9, Val loss: 0.5989, Val F1: 0.7886
Epoch 10, Val loss: 0.5126, Val F1: 0.8178
Epoch 11, Val loss: 0.6197, Val F1: 0.7783
Epoch 12, Val loss: 0.5480, Val F1: 0.8066
Epoch 13, Val loss: 0.5307, Val F1: 0.8095
Epoch 14, Val loss: 0.4995, Val F1: 0.8283
Epoch 15, Val loss: 0.4791, Val F1: 0.8400
Epoch 16, Val loss: 0.4852, Val F1: 0.8335
Epoch 17, Val loss: 0.5057, Val F1: 0.8330
Epoch 18, Val loss: 0.8749, Val F1: 0.7511
Epoch 19, Val loss: 0.5383, Val F1: 0.8270
Epoch 20, Val loss: 0.8915, Val F1: 0.7524
[I 2026-06-07 22:13:47,636] Trial 10 pruned. 
Epoch 1, Val loss: 5.0711, Val F1: 0.2131
[I 2026-06-07 22:13:49,379] Trial 11 pruned. 
Epoch 1, Val loss: 2.0844, Val F1: 0.2167
[I 2026-06-07 22:13:51,101] Trial 12 pruned. 
Epoch 1, Val loss: 1.3730, Val F1: 0.4706
Epoch 2, Val loss: 0.6873, Val F1: 0.7358
Epoch 3, Val loss: 0.9629, Val F1: 0.6581
Epoch 4, Val loss: 1.2730, Val F1: 0.5508
Epoch 5, Val loss: 0.5474, Val F1: 0.8146
Epoch 6, Val loss: 0.8219, Val F1: 0.7111
Epoch 7, Val loss: 1.5237, Val F1: 0.5814
Epoch 8, Val loss: 0.4357, Val F1: 0.8529
Epoch 9, Val loss: 0.5653, Val F1: 0.8194
Epoch 10, Val loss: 0.4798, Val F1: 0.8359
Epoch 11, Val loss: 0.6032, Val F1: 0.8167
Epoch 12, Val loss: 0.6540, Val F1: 0.8185
Epoch 13, Val loss: 0.6626, Val F1: 0.7790
[I 2026-06-07 22:14:14,296] Trial 13 finished with value: 0.8528628031417126 and parameters: {'n_conv_blocks': 5, 'base_channels': 32, 'kernels_block_0': 'single_5', 'kernels_block_1': 'multi_3_7', 'kernels_block_2': 'single_5', 'kernels_block_3': 'single_5', 'kernels_block_4': 'single_3', 'n_fc_layers': 5, 'fc_hidden': 2048, 'dropout': 0.30444244775829193, 'activation': 'silu', 'lr': 0.00025786423215700164}. Best is trial 4 with value: 0.9322999117316391.
Epoch 1, Val loss: 1.3742, Val F1: 0.4987
Epoch 2, Val loss: 1.1753, Val F1: 0.5989
[I 2026-06-07 22:14:19,609] Trial 14 pruned. 
Epoch 1, Val loss: 2.9392, Val F1: 0.1952
[I 2026-06-07 22:14:21,482] Trial 15 pruned. 
Epoch 1, Val loss: 0.8091, Val F1: 0.6917
Epoch 2, Val loss: 0.7170, Val F1: 0.7414
Epoch 3, Val loss: 0.5347, Val F1: 0.7934
Epoch 4, Val loss: 0.6716, Val F1: 0.7575
Epoch 5, Val loss: 0.4353, Val F1: 0.8468
Epoch 6, Val loss: 0.6768, Val F1: 0.7674
Epoch 7, Val loss: 0.6323, Val F1: 0.7926
Epoch 8, Val loss: 0.6418, Val F1: 0.8024
Epoch 9, Val loss: 0.8930, Val F1: 0.7348
Epoch 10, Val loss: 0.5702, Val F1: 0.8203
[I 2026-06-07 22:14:41,211] Trial 16 finished with value: 0.8467593252416986 and parameters: {'n_conv_blocks': 2, 'base_channels': 32, 'kernels_block_0': 'multi_3_7', 'kernels_block_1': 'multi_3_5_7_9', 'n_fc_layers': 3, 'fc_hidden': 2048, 'dropout': 0.27834826020871883, 'activation': 'gelu', 'lr': 0.00036497992786121134}. Best is trial 4 with value: 0.9322999117316391.
Epoch 1, Val loss: 1.2583, Val F1: 0.5509
Epoch 2, Val loss: 0.6217, Val F1: 0.7546
Epoch 3, Val loss: 0.6346, Val F1: 0.7704
Epoch 4, Val loss: 0.5930, Val F1: 0.7946
Epoch 5, Val loss: 0.4164, Val F1: 0.8597
Epoch 6, Val loss: 0.3699, Val F1: 0.8724
Epoch 7, Val loss: 0.3164, Val F1: 0.8953
Epoch 8, Val loss: 0.4130, Val F1: 0.8702
Epoch 9, Val loss: 0.2911, Val F1: 0.8987
Epoch 10, Val loss: 0.3531, Val F1: 0.8768
Epoch 11, Val loss: 0.4878, Val F1: 0.8412
Epoch 12, Val loss: 0.2659, Val F1: 0.9132
Epoch 13, Val loss: 0.2317, Val F1: 0.9251
Epoch 14, Val loss: 0.2497, Val F1: 0.9205
Epoch 15, Val loss: 0.2557, Val F1: 0.9220
Epoch 16, Val loss: 0.2132, Val F1: 0.9342
Epoch 17, Val loss: 0.2843, Val F1: 0.9123
Epoch 18, Val loss: 0.2730, Val F1: 0.9167
Epoch 19, Val loss: 0.2500, Val F1: 0.9173
Epoch 20, Val loss: 0.2930, Val F1: 0.9087
Epoch 21, Val loss: 0.4839, Val F1: 0.8565
[I 2026-06-07 22:15:19,882] Trial 17 finished with value: 0.9342270105775261 and parameters: {'n_conv_blocks': 4, 'base_channels': 64, 'kernels_block_0': 'multi_3_5_7_9', 'kernels_block_1': 'multi_3_5', 'kernels_block_2': 'single_5', 'kernels_block_3': 'multi_3_5', 'n_fc_layers': 5, 'fc_hidden': 512, 'dropout': 0.3788503702965206, 'activation': 'gelu', 'lr': 0.00013974584721672135}. Best is trial 17 with value: 0.9342270105775261.
Epoch 1, Val loss: 1.1532, Val F1: 0.5301
Epoch 2, Val loss: 0.7888, Val F1: 0.7082
Epoch 3, Val loss: 0.6350, Val F1: 0.7686
Epoch 4, Val loss: 0.5698, Val F1: 0.7915
Epoch 5, Val loss: 0.7915, Val F1: 0.7337
Epoch 6, Val loss: 0.5256, Val F1: 0.8148
Epoch 7, Val loss: 0.5683, Val F1: 0.8058
Epoch 8, Val loss: 0.4238, Val F1: 0.8372
Epoch 9, Val loss: 0.4552, Val F1: 0.8557
Epoch 10, Val loss: 0.6632, Val F1: 0.8014
Epoch 11, Val loss: 0.3504, Val F1: 0.8790
Epoch 12, Val loss: 0.8144, Val F1: 0.7768
Epoch 13, Val loss: 0.5094, Val F1: 0.8486
Epoch 14, Val loss: 0.3337, Val F1: 0.8903
Epoch 15, Val loss: 0.4776, Val F1: 0.8501
Epoch 16, Val loss: 0.5195, Val F1: 0.8478
Epoch 17, Val loss: 0.3699, Val F1: 0.8845
Epoch 18, Val loss: 0.4599, Val F1: 0.8643
Epoch 19, Val loss: 1.0738, Val F1: 0.7660
[I 2026-06-07 22:15:54,461] Trial 18 finished with value: 0.890312392594047 and parameters: {'n_conv_blocks': 3, 'base_channels': 64, 'kernels_block_0': 'multi_3_5_7_9', 'kernels_block_1': 'multi_3_7', 'kernels_block_2': 'single_5', 'n_fc_layers': 6, 'fc_hidden': 512, 'dropout': 0.3940676921274522, 'activation': 'silu', 'lr': 0.00010674576588743566}. Best is trial 17 with value: 0.9342270105775261.
Epoch 1, Val loss: 1.6052, Val F1: 0.1879
[I 2026-06-07 22:15:56,345] Trial 19 pruned. 
Epoch 1, Val loss: 1.1124, Val F1: 0.5881
Epoch 2, Val loss: 0.8197, Val F1: 0.7012
[I 2026-06-07 22:16:00,359] Trial 20 pruned. 
Epoch 1, Val loss: 1.0278, Val F1: 0.6258
Epoch 2, Val loss: 1.8516, Val F1: 0.4302
[I 2026-06-07 22:16:04,128] Trial 21 pruned. 
Epoch 1, Val loss: 1.3012, Val F1: 0.4789
[I 2026-06-07 22:16:05,915] Trial 22 pruned. 
Epoch 1, Val loss: 1.7548, Val F1: 0.2989
[I 2026-06-07 22:16:09,051] Trial 23 pruned. 
Epoch 1, Val loss: 0.5834, Val F1: 0.7786
Epoch 2, Val loss: 0.4620, Val F1: 0.8315
Epoch 3, Val loss: 0.3938, Val F1: 0.8536
Epoch 4, Val loss: 0.5526, Val F1: 0.8064
Epoch 5, Val loss: 0.4249, Val F1: 0.8556
Epoch 6, Val loss: 0.2622, Val F1: 0.9066
Epoch 7, Val loss: 0.4909, Val F1: 0.8255
Epoch 8, Val loss: 0.3019, Val F1: 0.8948
Epoch 9, Val loss: 0.3908, Val F1: 0.8714
Epoch 10, Val loss: 1.0604, Val F1: 0.7561
Epoch 11, Val loss: 0.3779, Val F1: 0.8698
[I 2026-06-07 22:16:28,979] Trial 24 finished with value: 0.9065836315928919 and parameters: {'n_conv_blocks': 4, 'base_channels': 64, 'kernels_block_0': 'single_5', 'kernels_block_1': 'multi_3_5', 'kernels_block_2': 'single_5', 'kernels_block_3': 'multi_3_5', 'n_fc_layers': 1, 'fc_hidden': 128, 'dropout': 0.3308580032423565, 'activation': 'gelu', 'lr': 0.0001678354449666571}. Best is trial 17 with value: 0.9342270105775261.
Epoch 1, Val loss: 3.6455, Val F1: 0.1891
[I 2026-06-07 22:16:30,786] Trial 25 pruned. 
Epoch 1, Val loss: 0.9216, Val F1: 0.6790
Epoch 2, Val loss: 1.4211, Val F1: 0.5615
[I 2026-06-07 22:16:34,999] Trial 26 pruned. 
Epoch 1, Val loss: 1.7485, Val F1: 0.2056
[I 2026-06-07 22:16:36,803] Trial 27 pruned. 
Epoch 1, Val loss: 1.7650, Val F1: 0.2389
[I 2026-06-07 22:16:38,604] Trial 28 pruned. 
Epoch 1, Val loss: 1.0183, Val F1: 0.6063
Epoch 2, Val loss: 2.7158, Val F1: 0.3826
[I 2026-06-07 22:16:42,353] Trial 29 pruned. 
Epoch 1, Val loss: 1.6305, Val F1: 0.2830
[I 2026-06-07 22:16:44,227] Trial 30 pruned. 
Epoch 1, Val loss: 0.5777, Val F1: 0.7880
Epoch 2, Val loss: 0.5663, Val F1: 0.7983
Epoch 3, Val loss: 0.4052, Val F1: 0.8582
Epoch 4, Val loss: 0.3472, Val F1: 0.8659
Epoch 5, Val loss: 0.4355, Val F1: 0.8380
Epoch 6, Val loss: 0.3547, Val F1: 0.8789
Epoch 7, Val loss: 0.3002, Val F1: 0.8945
Epoch 8, Val loss: 0.4862, Val F1: 0.8383
Epoch 9, Val loss: 0.4000, Val F1: 0.8517
Epoch 10, Val loss: 0.3157, Val F1: 0.8840
Epoch 11, Val loss: 0.2362, Val F1: 0.9244
Epoch 12, Val loss: 0.2384, Val F1: 0.9162
Epoch 13, Val loss: 0.2653, Val F1: 0.9091
Epoch 14, Val loss: 0.1890, Val F1: 0.9389
Epoch 15, Val loss: 0.2097, Val F1: 0.9303
Epoch 16, Val loss: 0.2071, Val F1: 0.9329
Epoch 17, Val loss: 0.2039, Val F1: 0.9301
Epoch 18, Val loss: 0.1745, Val F1: 0.9479
Epoch 19, Val loss: 0.2829, Val F1: 0.9163
Epoch 20, Val loss: 0.2583, Val F1: 0.9258
Epoch 21, Val loss: 0.5465, Val F1: 0.8537
Epoch 22, Val loss: 0.5297, Val F1: 0.8674
Epoch 23, Val loss: 0.2984, Val F1: 0.9098
[I 2026-06-07 22:17:25,167] Trial 31 finished with value: 0.9478749472255297 and parameters: {'n_conv_blocks': 4, 'base_channels': 64, 'kernels_block_0': 'single_5', 'kernels_block_1': 'multi_3_5', 'kernels_block_2': 'single_5', 'kernels_block_3': 'multi_3_5', 'n_fc_layers': 1, 'fc_hidden': 128, 'dropout': 0.33462187649726105, 'activation': 'gelu', 'lr': 0.0001613629439543029}. Best is trial 31 with value: 0.9478749472255297.
Epoch 1, Val loss: 1.0878, Val F1: 0.6255
Epoch 2, Val loss: 1.7749, Val F1: 0.5001
[I 2026-06-07 22:17:28,757] Trial 32 pruned. 
Epoch 1, Val loss: 0.6773, Val F1: 0.7266
Epoch 2, Val loss: 0.5923, Val F1: 0.7925
Epoch 3, Val loss: 0.4573, Val F1: 0.8345
Epoch 4, Val loss: 0.6424, Val F1: 0.7907
Epoch 5, Val loss: 0.3617, Val F1: 0.8782
Epoch 6, Val loss: 0.3786, Val F1: 0.8723
Epoch 7, Val loss: 1.8605, Val F1: 0.5956
Epoch 8, Val loss: 0.4302, Val F1: 0.8465
Epoch 9, Val loss: 0.5347, Val F1: 0.8360
Epoch 10, Val loss: 0.4100, Val F1: 0.8747
[I 2026-06-07 22:17:46,527] Trial 33 finished with value: 0.8782458017428729 and parameters: {'n_conv_blocks': 4, 'base_channels': 64, 'kernels_block_0': 'single_5', 'kernels_block_1': 'multi_3_5', 'kernels_block_2': 'single_5', 'kernels_block_3': 'multi_3_5', 'n_fc_layers': 2, 'fc_hidden': 128, 'dropout': 0.3642043276437298, 'activation': 'gelu', 'lr': 0.00012920979694466125}. Best is trial 31 with value: 0.9478749472255297.
Epoch 1, Val loss: 0.9460, Val F1: 0.6654
Epoch 2, Val loss: 0.9036, Val F1: 0.6632
[I 2026-06-07 22:17:50,125] Trial 34 pruned. 
Epoch 1, Val loss: 0.7179, Val F1: 0.7322
Epoch 2, Val loss: 0.8795, Val F1: 0.6771
[I 2026-06-07 22:17:55,163] Trial 35 pruned. 
Epoch 1, Val loss: 1.3584, Val F1: 0.4437
[I 2026-06-07 22:17:56,928] Trial 36 pruned. 
Epoch 1, Val loss: 0.6187, Val F1: 0.7817
Epoch 2, Val loss: 0.5869, Val F1: 0.7805
Epoch 3, Val loss: 0.4078, Val F1: 0.8553
Epoch 4, Val loss: 0.2896, Val F1: 0.8998
Epoch 5, Val loss: 0.3198, Val F1: 0.8991
Epoch 6, Val loss: 0.2865, Val F1: 0.8995
Epoch 7, Val loss: 0.2645, Val F1: 0.9071
Epoch 8, Val loss: 0.2738, Val F1: 0.9040
Epoch 9, Val loss: 0.4367, Val F1: 0.8668
Epoch 10, Val loss: 0.1750, Val F1: 0.9413
Epoch 11, Val loss: 0.1848, Val F1: 0.9376
Epoch 12, Val loss: 0.2240, Val F1: 0.9263
Epoch 13, Val loss: 0.2861, Val F1: 0.9147
Epoch 14, Val loss: 0.1789, Val F1: 0.9441
Epoch 15, Val loss: 0.3277, Val F1: 0.9051
Epoch 16, Val loss: 0.3117, Val F1: 0.9091
Epoch 17, Val loss: 0.1825, Val F1: 0.9423
Epoch 18, Val loss: 0.1824, Val F1: 0.9418
Epoch 19, Val loss: 0.1983, Val F1: 0.9446
Epoch 20, Val loss: 0.3023, Val F1: 0.9189
Epoch 21, Val loss: 0.2260, Val F1: 0.9316
Epoch 22, Val loss: 0.2069, Val F1: 0.9378
Epoch 23, Val loss: 0.3001, Val F1: 0.9150
Epoch 24, Val loss: 0.3423, Val F1: 0.9000
