=== Job started: Wed May 27 02:04:47 CEST 2026 ===
Node:       rtx6000gpu3
Image type: ms
=== Python: Python 3.12.13 | venv active ===
=== Starting hyperparameter tuning (ms) ===

=== Tuning ms ===
Removed 0 bombay files and 0 jakarta files from SeaLake
[I 2026-05-27 02:04:53,725] A new study created in memory with name: ms
Epoch 1, Val loss: 0.3323, Val F1: 0.8874
Epoch 2, Val loss: 0.2910, Val F1: 0.9040
Epoch 3, Val loss: 0.2830, Val F1: 0.8997
Epoch 4, Val loss: 0.1747, Val F1: 0.9441
Epoch 5, Val loss: 0.1970, Val F1: 0.9367
Epoch 6, Val loss: 0.1637, Val F1: 0.9488
Epoch 7, Val loss: 0.1556, Val F1: 0.9480
Epoch 8, Val loss: 0.2047, Val F1: 0.9334
Epoch 9, Val loss: 0.1907, Val F1: 0.9413
Epoch 10, Val loss: 0.1333, Val F1: 0.9580
Epoch 11, Val loss: 0.1737, Val F1: 0.9408
Epoch 12, Val loss: 0.1999, Val F1: 0.9465
Epoch 13, Val loss: 0.1462, Val F1: 0.9629
Epoch 14, Val loss: 0.2004, Val F1: 0.9434
Epoch 15, Val loss: 0.1376, Val F1: 0.9601
Epoch 16, Val loss: 0.1167, Val F1: 0.9701
Epoch 17, Val loss: 0.1352, Val F1: 0.9637
Epoch 18, Val loss: 0.1712, Val F1: 0.9586
Epoch 19, Val loss: 0.2111, Val F1: 0.9481
Epoch 20, Val loss: 0.1474, Val F1: 0.9621
Epoch 21, Val loss: 0.1419, Val F1: 0.9597
[I 2026-05-27 02:05:51,594] Trial 0 finished with value: 0.9700902757683322 and parameters: {'n_conv_blocks': 3, 'base_channels': 32, 'fc_hidden': 256, 'dropout': 0.20841358684024205, 'activation': 'relu', 'lr': 0.0012734547491251686}. Best is trial 0 with value: 0.9700902757683322.
Epoch 1, Val loss: 0.4495, Val F1: 0.8365
Epoch 2, Val loss: 0.3039, Val F1: 0.8972
Epoch 3, Val loss: 0.2442, Val F1: 0.9219
Epoch 4, Val loss: 0.2076, Val F1: 0.9308
Epoch 5, Val loss: 0.2789, Val F1: 0.9054
Epoch 6, Val loss: 0.1954, Val F1: 0.9369
Epoch 7, Val loss: 0.2487, Val F1: 0.9195
Epoch 8, Val loss: 0.1765, Val F1: 0.9453
Epoch 9, Val loss: 0.1769, Val F1: 0.9416
Epoch 10, Val loss: 0.1629, Val F1: 0.9456
Epoch 11, Val loss: 0.1656, Val F1: 0.9430
Epoch 12, Val loss: 0.1580, Val F1: 0.9514
Epoch 13, Val loss: 0.1603, Val F1: 0.9503
Epoch 14, Val loss: 0.1499, Val F1: 0.9555
Epoch 15, Val loss: 0.1539, Val F1: 0.9532
Epoch 16, Val loss: 0.1475, Val F1: 0.9586
Epoch 17, Val loss: 0.1314, Val F1: 0.9592
Epoch 18, Val loss: 0.1557, Val F1: 0.9568
Epoch 19, Val loss: 0.1572, Val F1: 0.9532
Epoch 20, Val loss: 0.1526, Val F1: 0.9560
Epoch 21, Val loss: 0.1490, Val F1: 0.9605
Epoch 22, Val loss: 0.1216, Val F1: 0.9664
Epoch 23, Val loss: 0.1259, Val F1: 0.9680
Epoch 24, Val loss: 0.2139, Val F1: 0.9449
Epoch 25, Val loss: 0.1424, Val F1: 0.9602
Epoch 26, Val loss: 0.1503, Val F1: 0.9605
Epoch 27, Val loss: 0.1401, Val F1: 0.9618
Epoch 28, Val loss: 0.1581, Val F1: 0.9635
[I 2026-05-27 02:07:06,300] Trial 1 finished with value: 0.96803081264771 and parameters: {'n_conv_blocks': 3, 'base_channels': 32, 'fc_hidden': 64, 'dropout': 0.480561686075227, 'activation': 'silu', 'lr': 0.0009567628932396049}. Best is trial 0 with value: 0.9700902757683322.
Epoch 1, Val loss: 0.4167, Val F1: 0.8591
Epoch 2, Val loss: 0.2849, Val F1: 0.9075
Epoch 3, Val loss: 0.2536, Val F1: 0.9216
Epoch 4, Val loss: 0.1909, Val F1: 0.9374
Epoch 5, Val loss: 0.1716, Val F1: 0.9430
Epoch 6, Val loss: 0.1981, Val F1: 0.9394
Epoch 7, Val loss: 0.1707, Val F1: 0.9428
Epoch 8, Val loss: 0.1149, Val F1: 0.9633
Epoch 9, Val loss: 0.1306, Val F1: 0.9580
Epoch 10, Val loss: 0.2007, Val F1: 0.9434
Epoch 11, Val loss: 0.1270, Val F1: 0.9609
Epoch 12, Val loss: 0.1136, Val F1: 0.9650
Epoch 13, Val loss: 0.0992, Val F1: 0.9726
Epoch 14, Val loss: 0.1370, Val F1: 0.9593
Epoch 15, Val loss: 0.1071, Val F1: 0.9679
Epoch 16, Val loss: 0.1243, Val F1: 0.9639
Epoch 17, Val loss: 0.1084, Val F1: 0.9645
Epoch 18, Val loss: 0.1096, Val F1: 0.9636
[I 2026-05-27 02:07:54,634] Trial 2 finished with value: 0.9725691198533989 and parameters: {'n_conv_blocks': 3, 'base_channels': 64, 'fc_hidden': 128, 'dropout': 0.5110967264419393, 'activation': 'relu', 'lr': 0.0002391605512994443}. Best is trial 2 with value: 0.9725691198533989.
Epoch 1, Val loss: 0.2946, Val F1: 0.8983
Epoch 2, Val loss: 0.2446, Val F1: 0.9159
Epoch 3, Val loss: 0.1851, Val F1: 0.9353
Epoch 4, Val loss: 0.1634, Val F1: 0.9427
Epoch 5, Val loss: 0.1373, Val F1: 0.9514
Epoch 6, Val loss: 0.1309, Val F1: 0.9579
Epoch 7, Val loss: 0.1368, Val F1: 0.9553
Epoch 8, Val loss: 0.1419, Val F1: 0.9529
Epoch 9, Val loss: 0.1070, Val F1: 0.9661
Epoch 10, Val loss: 0.1243, Val F1: 0.9600
Epoch 11, Val loss: 0.1152, Val F1: 0.9645
Epoch 12, Val loss: 0.1420, Val F1: 0.9566
Epoch 13, Val loss: 0.1142, Val F1: 0.9663
Epoch 14, Val loss: 0.1476, Val F1: 0.9565
Epoch 15, Val loss: 0.1148, Val F1: 0.9646
Epoch 16, Val loss: 0.1627, Val F1: 0.9537
Epoch 17, Val loss: 0.1140, Val F1: 0.9680
Epoch 18, Val loss: 0.1427, Val F1: 0.9614
Epoch 19, Val loss: 0.1325, Val F1: 0.9618
Epoch 20, Val loss: 0.1605, Val F1: 0.9534
Epoch 21, Val loss: 0.1090, Val F1: 0.9690
Epoch 22, Val loss: 0.1711, Val F1: 0.9541
Epoch 23, Val loss: 0.1811, Val F1: 0.9555
Epoch 24, Val loss: 0.1365, Val F1: 0.9655
Epoch 25, Val loss: 0.1345, Val F1: 0.9656
Epoch 26, Val loss: 0.1288, Val F1: 0.9657
[I 2026-05-27 02:09:01,841] Trial 3 finished with value: 0.9690053894006162 and parameters: {'n_conv_blocks': 3, 'base_channels': 32, 'fc_hidden': 256, 'dropout': 0.27591794939999603, 'activation': 'gelu', 'lr': 0.0001652060574819327}. Best is trial 2 with value: 0.9725691198533989.
Epoch 1, Val loss: 0.4855, Val F1: 0.8272
Epoch 2, Val loss: 0.3533, Val F1: 0.8707
Epoch 3, Val loss: 0.3460, Val F1: 0.8848
Epoch 4, Val loss: 0.2515, Val F1: 0.9161
Epoch 5, Val loss: 0.2124, Val F1: 0.9317
Epoch 6, Val loss: 0.2226, Val F1: 0.9318
Epoch 7, Val loss: 0.2644, Val F1: 0.9136
Epoch 8, Val loss: 0.2042, Val F1: 0.9359
Epoch 9, Val loss: 0.1851, Val F1: 0.9391
Epoch 10, Val loss: 0.1976, Val F1: 0.9403
Epoch 11, Val loss: 0.2497, Val F1: 0.9299
Epoch 12, Val loss: 0.2321, Val F1: 0.9253
Epoch 13, Val loss: 0.2174, Val F1: 0.9390
Epoch 14, Val loss: 0.3043, Val F1: 0.9219
Epoch 15, Val loss: 0.2245, Val F1: 0.9365
[I 2026-05-27 02:09:40,215] Trial 4 finished with value: 0.9403282341140826 and parameters: {'n_conv_blocks': 2, 'base_channels': 16, 'fc_hidden': 128, 'dropout': 0.2747120306699876, 'activation': 'gelu', 'lr': 0.0017714531231434534}. Best is trial 2 with value: 0.9725691198533989.
Epoch 1, Val loss: 0.4391, Val F1: 0.8398
[I 2026-05-27 02:09:42,799] Trial 5 pruned. 
Epoch 1, Val loss: 0.4153, Val F1: 0.8595
Epoch 2, Val loss: 0.3299, Val F1: 0.8774
[I 2026-05-27 02:09:47,934] Trial 6 pruned. 
Epoch 1, Val loss: 0.5355, Val F1: 0.8257
[I 2026-05-27 02:09:50,495] Trial 7 pruned. 
Epoch 1, Val loss: 0.4475, Val F1: 0.8581
[I 2026-05-27 02:09:53,244] Trial 8 pruned. 
Epoch 1, Val loss: 1.2011, Val F1: 0.5095
[I 2026-05-27 02:09:55,777] Trial 9 pruned. 
Epoch 1, Val loss: 0.2724, Val F1: 0.9054
Epoch 2, Val loss: 0.2107, Val F1: 0.9304
Epoch 3, Val loss: 0.1547, Val F1: 0.9488
Epoch 4, Val loss: 0.1345, Val F1: 0.9565
Epoch 5, Val loss: 0.1307, Val F1: 0.9581
Epoch 6, Val loss: 0.1338, Val F1: 0.9577
Epoch 7, Val loss: 0.1208, Val F1: 0.9608
Epoch 8, Val loss: 0.1105, Val F1: 0.9641
Epoch 9, Val loss: 0.0861, Val F1: 0.9743
Epoch 10, Val loss: 0.1004, Val F1: 0.9697
Epoch 11, Val loss: 0.1181, Val F1: 0.9648
Epoch 12, Val loss: 0.0891, Val F1: 0.9732
Epoch 13, Val loss: 0.1006, Val F1: 0.9705
Epoch 14, Val loss: 0.1004, Val F1: 0.9714
[I 2026-05-27 02:10:31,629] Trial 10 finished with value: 0.974348424925379 and parameters: {'n_conv_blocks': 4, 'base_channels': 64, 'fc_hidden': 64, 'dropout': 0.37632899338807235, 'activation': 'relu', 'lr': 0.0001104292255091986}. Best is trial 10 with value: 0.974348424925379.
Epoch 1, Val loss: 0.2520, Val F1: 0.9139
Epoch 2, Val loss: 0.2288, Val F1: 0.9204
Epoch 3, Val loss: 0.1680, Val F1: 0.9436
Epoch 4, Val loss: 0.1888, Val F1: 0.9416
Epoch 5, Val loss: 0.1250, Val F1: 0.9594
Epoch 6, Val loss: 0.1294, Val F1: 0.9558
Epoch 7, Val loss: 0.1014, Val F1: 0.9649
Epoch 8, Val loss: 0.1145, Val F1: 0.9631
Epoch 9, Val loss: 0.1006, Val F1: 0.9657
Epoch 10, Val loss: 0.0908, Val F1: 0.9726
Epoch 11, Val loss: 0.0933, Val F1: 0.9719
Epoch 12, Val loss: 0.1225, Val F1: 0.9603
Epoch 13, Val loss: 0.1118, Val F1: 0.9649
Epoch 14, Val loss: 0.0851, Val F1: 0.9738
Epoch 15, Val loss: 0.0827, Val F1: 0.9741
Epoch 16, Val loss: 0.0982, Val F1: 0.9718
Epoch 17, Val loss: 0.1011, Val F1: 0.9665
Epoch 18, Val loss: 0.1036, Val F1: 0.9679
Epoch 19, Val loss: 0.0798, Val F1: 0.9769
Epoch 20, Val loss: 0.0883, Val F1: 0.9742
Epoch 21, Val loss: 0.0938, Val F1: 0.9721
Epoch 22, Val loss: 0.0880, Val F1: 0.9749
Epoch 23, Val loss: 0.0872, Val F1: 0.9772
Epoch 24, Val loss: 0.0776, Val F1: 0.9772
Epoch 25, Val loss: 0.0858, Val F1: 0.9747
Epoch 26, Val loss: 0.0844, Val F1: 0.9750
Epoch 27, Val loss: 0.0910, Val F1: 0.9757
Epoch 28, Val loss: 0.0834, Val F1: 0.9788
Epoch 29, Val loss: 0.1248, Val F1: 0.9661
Epoch 30, Val loss: 0.0865, Val F1: 0.9739
[I 2026-05-27 02:11:50,626] Trial 11 finished with value: 0.9787679645053176 and parameters: {'n_conv_blocks': 4, 'base_channels': 64, 'fc_hidden': 64, 'dropout': 0.38050484962955705, 'activation': 'relu', 'lr': 0.00010464622410059469}. Best is trial 11 with value: 0.9787679645053176.
Epoch 1, Val loss: 0.3089, Val F1: 0.9013
Epoch 2, Val loss: 0.2179, Val F1: 0.9247
Epoch 3, Val loss: 0.1674, Val F1: 0.9456
Epoch 4, Val loss: 0.2281, Val F1: 0.9144
Epoch 5, Val loss: 0.1378, Val F1: 0.9539
Epoch 6, Val loss: 0.1388, Val F1: 0.9537
Epoch 7, Val loss: 0.1208, Val F1: 0.9624
Epoch 8, Val loss: 0.0959, Val F1: 0.9681
Epoch 9, Val loss: 0.1502, Val F1: 0.9523
Epoch 10, Val loss: 0.0949, Val F1: 0.9689
Epoch 11, Val loss: 0.1342, Val F1: 0.9568
Epoch 12, Val loss: 0.0939, Val F1: 0.9710
Epoch 13, Val loss: 0.0967, Val F1: 0.9719
Epoch 14, Val loss: 0.0812, Val F1: 0.9738
Epoch 15, Val loss: 0.1059, Val F1: 0.9678
Epoch 16, Val loss: 0.1071, Val F1: 0.9688
Epoch 17, Val loss: 0.0972, Val F1: 0.9703
Epoch 18, Val loss: 0.1006, Val F1: 0.9717
Epoch 19, Val loss: 0.0827, Val F1: 0.9761
Epoch 20, Val loss: 0.0703, Val F1: 0.9805
Epoch 21, Val loss: 0.0912, Val F1: 0.9720
Epoch 22, Val loss: 0.0952, Val F1: 0.9720
Epoch 23, Val loss: 0.0871, Val F1: 0.9772
Epoch 24, Val loss: 0.0821, Val F1: 0.9769
Epoch 25, Val loss: 0.0944, Val F1: 0.9725
[I 2026-05-27 02:12:56,317] Trial 12 finished with value: 0.9804871595774749 and parameters: {'n_conv_blocks': 4, 'base_channels': 64, 'fc_hidden': 64, 'dropout': 0.38217102063179526, 'activation': 'relu', 'lr': 0.00010200960558027954}. Best is trial 12 with value: 0.9804871595774749.
Epoch 1, Val loss: 0.3717, Val F1: 0.8850
[I 2026-05-27 02:12:59,060] Trial 13 pruned. 
Epoch 1, Val loss: 0.2808, Val F1: 0.9003
Epoch 2, Val loss: 0.2074, Val F1: 0.9302
Epoch 3, Val loss: 0.1675, Val F1: 0.9435
Epoch 4, Val loss: 0.1530, Val F1: 0.9531
Epoch 5, Val loss: 0.1381, Val F1: 0.9550
Epoch 6, Val loss: 0.1546, Val F1: 0.9480
Epoch 7, Val loss: 0.1353, Val F1: 0.9542
Epoch 8, Val loss: 0.1271, Val F1: 0.9605
Epoch 9, Val loss: 0.0938, Val F1: 0.9690
Epoch 10, Val loss: 0.1363, Val F1: 0.9580
Epoch 11, Val loss: 0.1407, Val F1: 0.9554
Epoch 12, Val loss: 0.1083, Val F1: 0.9663
Epoch 13, Val loss: 0.0833, Val F1: 0.9742
Epoch 14, Val loss: 0.0933, Val F1: 0.9673
Epoch 15, Val loss: 0.1096, Val F1: 0.9674
Epoch 16, Val loss: 0.1052, Val F1: 0.9672
Epoch 17, Val loss: 0.1098, Val F1: 0.9709
Epoch 18, Val loss: 0.1083, Val F1: 0.9689
[I 2026-05-27 02:13:45,973] Trial 14 finished with value: 0.974244100571832 and parameters: {'n_conv_blocks': 4, 'base_channels': 64, 'fc_hidden': 64, 'dropout': 0.334516026626006, 'activation': 'relu', 'lr': 0.00010137759481391853}. Best is trial 12 with value: 0.9804871595774749.
Epoch 1, Val loss: 1.3533, Val F1: 0.4402
[I 2026-05-27 02:13:48,501] Trial 15 pruned. 
Epoch 1, Val loss: 0.3206, Val F1: 0.8901
[I 2026-05-27 02:13:51,055] Trial 16 pruned. 
Epoch 1, Val loss: 0.3698, Val F1: 0.8805
[I 2026-05-27 02:13:53,589] Trial 17 pruned. 
Epoch 1, Val loss: 0.2819, Val F1: 0.9025
Epoch 2, Val loss: 0.2267, Val F1: 0.9272
Epoch 3, Val loss: 0.1481, Val F1: 0.9539
Epoch 4, Val loss: 0.1586, Val F1: 0.9427
Epoch 5, Val loss: 0.1517, Val F1: 0.9455
Epoch 6, Val loss: 0.1382, Val F1: 0.9548
Epoch 7, Val loss: 0.1345, Val F1: 0.9560
Epoch 8, Val loss: 0.0952, Val F1: 0.9690
Epoch 9, Val loss: 0.0830, Val F1: 0.9729
Epoch 10, Val loss: 0.0862, Val F1: 0.9706
Epoch 11, Val loss: 0.1055, Val F1: 0.9695
Epoch 12, Val loss: 0.0974, Val F1: 0.9688
Epoch 13, Val loss: 0.1180, Val F1: 0.9641
Epoch 14, Val loss: 0.0807, Val F1: 0.9733
Epoch 15, Val loss: 0.0887, Val F1: 0.9704
Epoch 16, Val loss: 0.0970, Val F1: 0.9661
Epoch 17, Val loss: 0.0859, Val F1: 0.9762
Epoch 18, Val loss: 0.0847, Val F1: 0.9748
Epoch 19, Val loss: 0.0851, Val F1: 0.9748
Epoch 20, Val loss: 0.0767, Val F1: 0.9789
Epoch 21, Val loss: 0.0834, Val F1: 0.9754
Epoch 22, Val loss: 0.0766, Val F1: 0.9777
Epoch 23, Val loss: 0.0832, Val F1: 0.9793
Epoch 24, Val loss: 0.1029, Val F1: 0.9696
Epoch 25, Val loss: 0.1020, Val F1: 0.9758
Epoch 26, Val loss: 0.0775, Val F1: 0.9792
Epoch 27, Val loss: 0.1043, Val F1: 0.9714
Epoch 28, Val loss: 0.0880, Val F1: 0.9773
[I 2026-05-27 02:15:07,007] Trial 18 finished with value: 0.979331859184691 and parameters: {'n_conv_blocks': 4, 'base_channels': 64, 'fc_hidden': 64, 'dropout': 0.4280293772030521, 'activation': 'relu', 'lr': 0.00012969210345005846}. Best is trial 12 with value: 0.9804871595774749.
Epoch 1, Val loss: 0.3369, Val F1: 0.8899
[I 2026-05-27 02:15:09,536] Trial 19 pruned. 
Epoch 1, Val loss: 0.3369, Val F1: 0.8836
[I 2026-05-27 02:15:12,089] Trial 20 pruned. 
Epoch 1, Val loss: 0.2561, Val F1: 0.9159
Epoch 2, Val loss: 0.2380, Val F1: 0.9183
Epoch 3, Val loss: 0.1550, Val F1: 0.9474
Epoch 4, Val loss: 0.1473, Val F1: 0.9531
Epoch 5, Val loss: 0.1458, Val F1: 0.9516
Epoch 6, Val loss: 0.1219, Val F1: 0.9612
Epoch 7, Val loss: 0.1007, Val F1: 0.9671
Epoch 8, Val loss: 0.0995, Val F1: 0.9673
Epoch 9, Val loss: 0.1231, Val F1: 0.9586
Epoch 10, Val loss: 0.1101, Val F1: 0.9664
Epoch 11, Val loss: 0.0871, Val F1: 0.9702
Epoch 12, Val loss: 0.0941, Val F1: 0.9715
Epoch 13, Val loss: 0.0946, Val F1: 0.9705
Epoch 14, Val loss: 0.0887, Val F1: 0.9766
Epoch 15, Val loss: 0.1090, Val F1: 0.9627
Epoch 16, Val loss: 0.0988, Val F1: 0.9731
Epoch 17, Val loss: 0.1036, Val F1: 0.9714
Epoch 18, Val loss: 0.1030, Val F1: 0.9686
Epoch 19, Val loss: 0.1177, Val F1: 0.9685
[I 2026-05-27 02:16:01,498] Trial 21 finished with value: 0.9766183243947095 and parameters: {'n_conv_blocks': 4, 'base_channels': 64, 'fc_hidden': 64, 'dropout': 0.4025937913246769, 'activation': 'relu', 'lr': 0.00010305541994620937}. Best is trial 12 with value: 0.9804871595774749.
Epoch 1, Val loss: 0.2796, Val F1: 0.9030
Epoch 2, Val loss: 0.2123, Val F1: 0.9250
Epoch 3, Val loss: 0.1838, Val F1: 0.9363
[I 2026-05-27 02:16:09,387] Trial 22 pruned. 
Epoch 1, Val loss: 0.3575, Val F1: 0.8827
[I 2026-05-27 02:16:11,957] Trial 23 pruned. 
Epoch 1, Val loss: 0.2927, Val F1: 0.8983
[I 2026-05-27 02:16:14,488] Trial 24 pruned. 
Epoch 1, Val loss: 0.3949, Val F1: 0.8653
[I 2026-05-27 02:16:17,107] Trial 25 pruned. 
Epoch 1, Val loss: 0.3052, Val F1: 0.8944
[I 2026-05-27 02:16:19,670] Trial 26 pruned. 
Epoch 1, Val loss: 0.4341, Val F1: 0.8669
[I 2026-05-27 02:16:22,285] Trial 27 pruned. 
Epoch 1, Val loss: 0.4832, Val F1: 0.8317
[I 2026-05-27 02:16:24,850] Trial 28 pruned. 
Epoch 1, Val loss: 0.8628, Val F1: 0.6652
[I 2026-05-27 02:16:27,436] Trial 29 pruned. 
Epoch 1, Val loss: 0.2736, Val F1: 0.9121
Epoch 2, Val loss: 0.2092, Val F1: 0.9342
Epoch 3, Val loss: 0.1722, Val F1: 0.9405
Epoch 4, Val loss: 0.1448, Val F1: 0.9514
Epoch 5, Val loss: 0.2210, Val F1: 0.9225
Epoch 6, Val loss: 0.1006, Val F1: 0.9686
Epoch 7, Val loss: 0.1076, Val F1: 0.9639
Epoch 8, Val loss: 0.1307, Val F1: 0.9592
Epoch 9, Val loss: 0.0986, Val F1: 0.9682
Epoch 10, Val loss: 0.1216, Val F1: 0.9604
Epoch 11, Val loss: 0.0878, Val F1: 0.9735
Epoch 12, Val loss: 0.1035, Val F1: 0.9685
Epoch 13, Val loss: 0.0813, Val F1: 0.9715
Epoch 14, Val loss: 0.0770, Val F1: 0.9780
Epoch 15, Val loss: 0.0853, Val F1: 0.9728
Epoch 16, Val loss: 0.1236, Val F1: 0.9632
Epoch 17, Val loss: 0.0824, Val F1: 0.9755
Epoch 18, Val loss: 0.0978, Val F1: 0.9661
Epoch 19, Val loss: 0.0776, Val F1: 0.9764
ms: best F1 = 0.9805, params = {'n_conv_blocks': 4, 'base_channels': 64, 'fc_hidden': 64, 'dropout': 0.38217102063179526, 'activation': 'relu', 'lr': 0.00010200960558027954}
=== Job finished: Wed May 27 02:17:18 CEST 2026 ===

###############################################################################
Hábrók Cluster
Job 29082657 for user s5964733
Finished at: Wed May 27 02:17:22 CEST 2026

Job details:
============

Job ID                         : 29082657
Name                           : tune_ms
User                           : s5964733
Partition                      : gpushort
Nodes                          : rtx6000gpu3
Number of Nodes                : 1
Cores                          : 8
Number of Tasks                : 1
State                          : COMPLETED  
Submit                         : 2026-05-27T02:04:45
Start                          : 2026-05-27T02:04:46
End                            : 2026-05-27T02:17:18
Reserved walltime              : 04:00:00
Used walltime                  : 00:12:32
Used CPU time                  : 00:51:36 (Efficiency: 51.45%)
% User (Computation)           : 78.37%
% System (I/O)                 : 21.63%
Total memory reserved          : 32G
Maximum memory used            : 4.49G
Requested GPUs                 : rtx_pro_6000=1
Allocated GPUs                 : rtx_pro_6000=1
Max GPU utilization            : 39%
Max GPU memory used            : 1.36G

Acknowledgements:
=================

Please see this page for information about acknowledging Hábrók in your publications:

https://wiki.hpc.rug.nl/habrok/introduction/scientific_output

################################################################################
